id,text,anti_lgbt
2540,3741,"I'm Brown, gay, trans, immigrant, poly and in interracial relationships. Did I win the minority lottery?",0
2542,46574,Your both fags asswipes,1
2544,49009,As a closeted trans guy the last words made me cry.,0
2545,33103,what do you think the b in lgbt+ means? biscuits? like hello bisexuality exists stop sleeping on it,0
2550,46370,"Damn the faggets,",1
2551,13394,"So what, retard faggot?",1
2555,49311,Shut up no. 2 in the world Swedish faggit...,1
2560,10563,"So many gay memes, no one to share them with",0
2561,24371,girls + gays parties are coming back full force this year and that's a promise,0
2564,7648,God of course I love trans girls 😍,0
2565,3404,YES I GET TO BE TRANS JINN This is my transition goals,0
2569,5248,"Women can be gay too, and engage in butt play. Nothing wrong with putting a bag on your dildo.",0
2570,44855,What the hell is wrong with you? Retarded? Gay? Gay and retarded? You sound like a idiot?,1
2571,13643,"Well done that man, woman, gender neutral, transsexual whatever. Mahalo.",0
2574,28565,@thomasnash270 fuck off you look like a rat get off btd6 u fag,1
2575,43579,She herself is a transgender. Her sister too.,0
2578,22365,my bitch is a barbie,0
2579,21014,"Via the HRC: Maine Gov. Janet Mills Signs Legislation Protecting LGBTQ Youth from ""Conversion Therapy"" ",0
2580,10092,Y'all memba when Trump murdered a bunch of gay people? I memba.,0
2582,41780,"Racist, homophobe, xenophobic deplorable since 2016... And damn proud of it 💕💕 #KAG",0
2583,14311,I can't wait to pump that little pussy of hers full of my cum while I bite those sensitive tiities,0
2585,9880,Come bitch ADAM is coming for u!!!! faggot,1
2586,47344,Terminator: Lesbian Road Trip,0
2587,8036,Hi I would love to talk girl talk with you! I'm trans and have always wanted a girl I can't talk with.,0
2589,41337,Gay ass mother fucker,1
2592,44903,He look gay as fuck 🤣,0
2593,7387,How am I fucked in the head? Trannies are subhuman trash.,1
2597,5093,"I've always enjoyed it when people wished me a happy pride, and that goes for most lgbt+ people I've met.",0
2599,16485,"What are the ""joys of being gay""",0
2602,32539,twicelights was a girl and gays event only,0
2605,14950,"Public attitudes in the US towards gay people.  Still a long way to go, but way better than it used to be.",0
2608,19229,Transgenders are a stain on humanity tbh,1
2609,17957,oh ok! I thought we were talking about a trans woman.,0
2611,15262,"They say gender is fluid, you look like all two of them",0
2615,17307,What a fag.,1
2617,9507,As a Ukrainian I was always under the impression that being a transgender man is horribly taboo. Good thing that wig is high quality.,0
2618,7891,"As gay as this sounds, nice legs man",0
2619,13217,Me as a trans female emt and nobody else is LGBT.,0
2620,28738,@Education4Libs @GaryRobinette1 Bunch of anti-American bitch dykes!,1
2621,12317,"Everything in 2019 is gay. Get over it, homophobe.",0
2625,11282,"How about you fuck off, faggot.",1
2626,45047,LGBTBBQWTFLOL Sorry we pissed off the fags and took away from their massive moment lol,1
2628,22440,GAPPY AND YASUHO SAID: TRANS RIGHTS ARE HUMAN RIGHTS,0
2630,13275,"Your trip to hell will be expedited because you are a fat sodomite who will die broke, failed, and alone :)",1
2631,19117,"Annoys me less than ""that's gay"" (even when it's an apparently hilarious and witty joke).",0
2632,13137,"shut your dumb dumb, bubble gum, google chrome using, chromosome collecting, sister pussy fucking, daddy dick sucking, faggot ass up.",1
2633,43362,Fuck both them fags,1
2636,10555,I'm 15m and am bi would be happy to help you explore.. And possibly even friends,0
2641,20574,@kash15111 Give my wire back u faggot,1
2643,18778,Yes! I love being trans but it is so tiring.,0
2644,44061,Htown Lifer no homo?,1
2646,48034,"You need to lay of the whole ""faggot"" talk. Not cool.",0
2647,28901,Does anyone else just feel really blessed to be gay,0
2650,11944,You're a nasty fucking fag.,1
2651,49673,bunch of trannys,1
2653,25813,"hello everyone its me ,as my friend would say, lil faggie: the entitled fag ",1
2654,36420,@appreciateejoon @s8n faggot,1
2658,10801,No cause their two faggots,1
2659,11752,"And you're a mentally ill man pretending to be a ""woman"". Have a nice day pedo",1
2660,49962,Shut the F up Queers,1
2661,6434,"You're bi. You just have some preferences. And you don't really need to find a label, unless you find one that suits you perfectly",0
2665,15558,Islam kills gays. Nothing to do with you being a rude boy.,0
2668,24699,@Cameron2nd_ @TheFUTAdvisor faggots,1
2669,9819,"Still trans, still out there trying to live my best life.",0
2670,50043,Love being lgbtq that she stands for us more then anyone always been a great talanted person the best in my eyes love her,0
2674,42385,"Man, this translation is off on more than just the ""mentally retarded"" part. This is rough.",0
2681,3844,Kill yourself attention seeking fucking faggot ass cunt,1
2685,43262,POS diseased homosexual Antiamerican lowlife liberal communist trash bag.,1
2686,2734,Are yiz all clown world faggots now?,0
2687,445,There is only 2 genders and transvestites have an mental condition.,0
2692,48975,The fact that he has those tattoos is crazy lmao dude is a fag,1
2698,35467,@1hvbd how about you come here and suck my cock faggot,1
2699,23813,Happy Pride Month from your friendly neighborhood lesbian dog moms💞🐶 ,0
2702,46200,I really admire the LGBT community for the hard work and inspiration.,0
2703,6643,hahaa it sliteraly a fig u retarded fags,1
2704,11382,Pff. Bitch ass slut ass whores.,1
2706,43268,Girl: I got two mothers. How is that even possible? Ppl from LGBTQ community: Are we a joke to you,0
2707,46833,Your FAGGOT AGENDA is sick you nasty FUCKS,1
2709,41144,This must be sarcasm...lol The host is a flaming homosexual.,1
2714,18561,"That's when you pick up a minor in gender studies as a ""fuck you.""",0
2716,56,"He's a fag, said it himself",0
2717,11154,Maybe you faggots should stop trying to get subs and websites banned and they won't invade your safe spaces.,1
2719,23039,I think only straight girls people go to pride,0
2721,368,ok that was homophobic,0
2723,19183,No doubt. The girls weren't obese and the gays weren't out trying to convert everyone by normalizing their degeneracy.,0
2725,16717,Gender Non Conforming.,0
2726,3509,You guys really are a bunch of faggots here,1
2727,26100,Fuck that fag bro,1
2730,9255,How you die useless FAggot,1
2731,6927,This place has seriously turned into the gayest fucking subreddit on the planet.,0
2733,9623,I'm so happy for you! Great job coming out as lesbian! <3,0
2735,4664,I have a lesbian friend. Although she's not really part of my typical guy friend group,0
2736,23211,how bout you take a worm shove it up your ass and that'll represent asexuals because y'all are shit,1
2737,47162,No wonder she's a lesbian,0
2738,45273,If these was done on a woman the network might have been shut done. Gender equality at its finest.,0
2739,12547,"Can confirm. am goth, is gf, has big titties, and has penis. #outingmyselfastrans",0
2740,42577,trans fucking robot? wtf man this looking like fucking garbage.. thanks sjw's may you burn in hell,0
2742,18891,Nah but I expect it to be fucking magical if people are supporting homophobia because of it,0
2743,15781,"As a trans guy with a girlfriend, fuck yes",0
2744,13211,Going Girl: a trans story,0
2746,30751,ICYMI: A brief from yesterday - Racine joins trend to ban conversion therapy for LGBT minors  via @WIExaminer,0
2748,22590,happy bride month you gay mother fuckers,1
2749,7272,You look beautiful girl. I love your makeup. I'm also a transgender woman,0
2750,4566,"The way I look at it, gender doesn't affect who I am attracted to! Male, female, non-binary... I love 'em all!",0
2751,31248,im gay what abt it,0
2752,49517,This gay ass blood is gay,0
2753,6551,Thats booba u faggot,1
2756,12592,The homophobia jumped out,0
2758,14185,Retarded motherfucker,1
2759,11329,Okay faggot ban me pussies.,1
2763,7037,"Acceptence and pride go hand in hand in this case, it's also to help people be proud to be gay, ya know?",0
2765,12309,Straight pride parade Methdesto It's all just too perfect,0
2766,38930,I would love to suck on that big black cock sucking all the cum out the head all the time that you can deliver why you fuck my throat,0
2768,3250,Post the shit or kill yourself faggot,1
2770,48398,These are dumb faggots I ever knew wow,1
2771,10072,Nah nigga miss me with that gay shit,1
2773,16554,Lol just like evryeone other leftist you are a massive faggot. I hope you get aids.,1
2778,24773,she doesn't have to pick a label she is the entire lgbt community.,0
2779,14233,I don't see how it relates but... fuck yeah trans rights,0
2780,13739,fake and gay lo,0
2781,42449,LOL you want to suck Trump's dick and tickle his ball sack faget queer,1
2782,15701,"I dunno, sounds pretty gay to me",0
2784,25080,This transgender pastor started his own church in the South. 🏳️‍🌈 #PrideMonth #LGBTQ ,0
2785,23234,"Happy pride everyone, Lucretia is a lesbian! @TheZoneCast #TheZoneCast #theadventurezone  ",0
2787,30530,suck my dick stupid bitch,1
2788,882,Omg I know right. Of my top 10 posts I think 8 are gay related 😂,0
2789,42267,ME2 FUCK YOU CNN WHORES QUEERS JEWS,1
2790,10320,"Very well made, also as a fellow bisexual I approve of your cuteness",0
2792,14872,fuck you cunt i am so done with your shit kill youself faggot,1
2795,19285,Yeah but a lot of straight men see pegging as gay,0
2799,6019,Up the shut fuck gay ass bot,1
2800,10304,"Polish people screaming ""we will kill you"" to gays  Also Polish people screaming ""there was no Polish death camps"", were gays were killed.",0
2801,14297,I wanna slide this throbbing bbc deep in that pussy get all that cream on my dick and balls 😈💦🍆,0
2802,26474,Ace/aro folks are Queer,0
2805,5319,I can't believe I used to be so averse to trans people. You are beautiful.,0
2806,4201,I'm going to be very busy being not gay with another man's uncircumcised dick in my mouth.,0
2810,40676,"this ""guy"" is a faggot",1
2811,48360,I cant stand this stupid little lesbian i cant wait till someone DESTROYS THIS BICH,1
2813,43640,Lol what a phaggot,1
2814,2081,They look like gay bdsm couples,0
2816,48904,fuk faze bunch of bitches,1
2817,14397,Go away you dirty sodomite !!,1
2818,20313,your dog an burnt i no straight your hetero is ok,0
2820,5675,"Yeah, but I never said word one about women not having sexual feelings, so I'm wondering why you're attributing this to me.",0
2822,10636,But in that case the trans player wouldn't be the cause of injury since the women regularly compete with/against other men?,0
2826,49224,"shudda just called it 6 idiots n a gay, fkn spotted the atheist the moment he opened his mouth, swear to God",0
2829,14964,I don't know what that means but you talk like a fag and your shit's all retarded. Way to fuck up a six-word comment.,1
2830,49065,No one cares jack your fucking gay,1
2831,43946,AHH MY GAY HEART IS MELTING,0
2832,21359,good night to trans women only,0
2835,6424,I hate fags because of this shit.,1
2837,17139,No im a trans girl who doesn't want my shoulders to broaden so i cna pass easier,0
2838,11333,Gay school...i hope i could shove my hoe into these bitches ass,0
2840,47056,Choke on a drunk man's dick queer,1
2841,3687,I think it's awesome to see a lesbian couple walking while holding hands in Russia.,0
2844,4303,"which is why i said ""pride parades""",0
2846,3845,"Great analysis, but Chinese do consider homosexuality unacceptable according to Confucius teachings.",0
2847,12401,You wanna get bikelocked wb bitch Or a brain bleed like you gay Asian butt boy lover fag,1
2848,961,Your husband is a fag,1
2849,48291,Congratulations... your a faggot,1
2850,14178,im trans as well. I understand how you feel,0
2851,3273,They are simply bunch of controlled faggots that hate America.,1
2852,12251,"cry some more, newfag",1
2853,15073,"Please don't reply to my comments if you joined after 2016, you disgusting subhuman newfag.",1
2854,49906,At least he's not gay,0
2856,49467,"USA has gone to HELL !! More misogynistic and homophobic degenerates, top down !!",0
2861,10972,No can confirm anons a faggot and is a pussy,1
2863,7220,I'm going to go out on a limb and posit that more heterosexual men have made more women cum than gay men have made women cum.,0
2864,1451,fag ass gay ass,1
2865,45877,Who else is gay caes i am well not gay but lesbian. Like your hair,0
2866,20578,Fuck all the gays,0
2872,2678,Put up barbed wire. Those lil faggit deserve it,1
2874,48032,"If you eat spam, You're gay",0
2875,17003,Translation: cultural appropriation of ethnic cuisine by the evil american state,0
2876,19878,The straights have discovered the real gay agenda! It's time to run. Hail Satan.,0
2877,9109,Shut up try-hard faggoty nerd,1
2878,44909,This guy seems like a gay douche,0
2880,15309,Kill urself faggot. Grow thicker skin. You will never survive in the real world.,1
2881,15737,why do so many homophobes have a poop fetish? INFO,0
2882,48433,LOL you homosexual sperm dumpsters make me laugh the site of a President Trump makes you weenie washer scream like little bitches,1
2883,8765,How are you going to kys faggot?,1
2884,4199,"Yes, we love a gender non-conforming icon!",0
2889,4649,"And youre a retard faggot waste of air. Just kill yourself please, none will miss you.",1
2890,46707,The beginning sounds like moonlight by x... Like if agree Leave gray if gay,0
2892,327,fags must be the only lifeform on earth that never reproduce but also never go extinct,1
2893,48365,"Female sports are a joke! Only queers watch that crap. Go make a sammich and male it right girly,",0
2896,48566,"I'm just gonna say it, this is the gayest most shallow garbage I've seen and none of the beta soy cucks are complaining about it",1
2899,9276,oooh so he put his peepee stick in the guys poopoo hole? thats are a gay!,0
2901,44767,So only gay people are bad? Dumb.,0
2902,6496,shut up you monkey faggot,1
2904,39641,Hit me with all the gay shit,0
2905,6739,Woman want the straight pride parade too!,0
2906,15070,Fight me faggot.,1
2910,16860,I hope you burn in the sun until you're a tiny faggot piece of bacon,1
2911,6449,Buncha fags.,1
2912,4551,1. You're talking shit  2. Go the fuck to sleep faggot,1
2916,9644,I met my friends sister and she guessed im trans in the 5 minute meeting WHAT THE FUCK We can suck at being closeted together :d,0
2917,6974,"Imagine claiming to stand for gay rights while simultaneously bragging about causing the financial ruin of a fellow gay man, sad.",0
2918,6026,"Seriously what a faggot. I dont hate gays, i hate faggots.",1
2920,7092,And Tom cruise is gay,0
2923,15499,Get a job and your own place first faggot,1
2926,683,So you're a gay fish?,0
2927,31319,Bitch fuck u,1
2928,26746,@SentimentSheith nasty faggot,1
2931,10798,Old is gay,0
2936,33178,choke on my dick bitch,1
2937,30539,Eat shit you edge lord faggots lol,1
2940,23372,"happy pride month! seokjin said be gay, drink vodka, commit crimes! 🌈",0
2941,13878,Much cuck so transgender bathrooms,0
2942,11800,Oh look a chapo fag is upset,1
2943,7242,Haha unintentionally yes. I'm bi & they're my fav,0
2944,408,"Joe Cumia is a faggot and a coward, just like his brother and just like his father. Bunch of limpdicks.",1
2945,11904,"Hey I'm a little! And I'm gay 😁 I love making new friends, if you wanna message me feel free ☺️",0
2947,41998,Holy shit... This comment section is full of faggots,1
2950,9140,"If you like the sensation of swallowing a load, that's gay.",0
2951,1660,That's decently obsolete at this point unfortunately. All the feminazi scientists making babies without us.,0
2953,21671,Back for more homophobia and misogyny,0
2954,28340,"Homosexuality is not a choice but homophobia is, stop being assh*les",0
2956,14820,Gender Euphoria Therapy?  I can dig this.,0
2957,40619,Faggot shit fuck your gay lame wack style,1
2960,4058,Rowley is trans and lesbian and we love and accept her.,0
2963,12392,"I'm a 24yr old bi guy, feel free to message me if you have any questions",0
2966,960,"shut up retard, go kill yourself",1
2967,40209,"Femininity doesn't always have to be ""sexy"". Why do women need to be sexualized to be considered feminine?",0
2969,27783,"""santino fontana for 'transphobia the musical'""",0
2970,13758,How in the fuck are you threatened by the queers?,0
2973,10396,Haha you're a retarded faggot aren't ya?,1
2974,2945,"I was 13. ""You're not bisexual. You're acting like a child wearing her parents' clothing and pretending to be an adult.""",0
2975,3830,shut up faggot. kill yourself l0l.,1
2977,18400,"Yes, you can have a fabulous career teaching gender studies to gender studies majors. That, or work in human resources.",0
2979,1721,I appreciate beauty even if I'm not sexually attracted to it.,0
2981,7353,"im unbelievably attracted to bi girls. especially with dominant energy, doesnt have to be dom though. works in my favour though haha",0
2987,25251,We definitely need more gay pigs to help normalisation 😂🤣🥓 ,1
2988,47343,I hope I'm wrong but I think our country is too immature and homophobic for Buttegieg.,0
2990,25375,chris evans said gay rights,0
2991,25402,@weed13181544 come on faggot you cant beat my brain,1
2992,741,How bout u go get fucked?,1
2993,28261,Furries are gay ,1
2994,46672,Bro Sean is the funniest one in all of these he's gotta be #1 personality no homo,0
2995,2158,Wow this shit is gay. Fuck off and die pussy,1
2996,2291,Find a cock and fuck it.,1
2997,2669,Because doing nothing while a virus infected and killed thousands of members of the gay community was such a competent move,0
2999,43488,3:08 *SO LONG GAY BOWSER* *THANK YOU SO MUCH FOR PLAYING MY GAME*,0
3003,3951,Appreciate the bi love! Happy Pride!,0
3004,18996,Why do we need to boycott chick fil a? Because of the Gay thing?,0
3006,7326,I try to use gender neutral body part slurs like asshole.,0
3007,47422,BEST. GENDER. REVEAL. EVER. Minus the almost dying part lmao,0
3009,58,"Late to the party, but I'm a bisexual Catholic. Still not out to my family, but I've slowly accepted this part of me!",0
3012,7090,"Neither does yours, tranny whore",1
3015,37808,"All I do is be vegetarian, eat pussy, be a lesbian and CRY",0
3017,31408,This earth so hell they callin niggas kings for sucking dick lmao bitch ill jus die straight,1
3018,4762,"Guess who gets thanked for amazing birthday parties. Is it pride month, or gay pride month?",0
3019,9091,Every trans woman I know (including me) loves it. Boobs get bigger and more round. it just feels better.,0
3028,16438,jacked off toilet shit fag,1
3029,38365,if my boy is hetero i will be disappointed but im still gonna accept him bc hes my baby,0
3030,48885,Proof faggots,1
3033,23386,genuine question. what's the difference in appropriateness for kids to see hetero characters and relationships vs lgbt characters and relationships?,0
3034,2925,"Snookie, you mega slut, is that you? Oh 6 foot tall, must be some guy in drag.",1
3035,48471,@Zenigundam You're a dumbass. Hold this L faggot.,1
3037,14844,love a girl with a big clit. Makes me feel like a stud in bed ;),0
3045,13972,"hey, trans woman here 7 years in. If you need to talk or have questions I'm your gal! :)",0
3051,7169,First state in the US to protect trans people from discrimination in employment/housing! I was kinda proud to learn that factoid. 1993.,0
3052,5465,"Thank you, as someone who is trans, it always hurts when people say it's a choice",0
3057,16840,Shut up pussy gay boi,0
3058,4900,What a bunch of posturing faggots.,1
3059,6730,No good homos I'd like to kick their lousy butts! FTFY,1
3061,49567,Isn't he the guy the UK executed for being gay?,0
3063,12958,I'd love sucking your big dick!,0
3070,45519,LOL typical faget comment drink bleach and die queer,1
3074,15666,"Gay Parade is one of their best, I've been repping it with this username for awhile",0
3076,13235,You've got a trans sister cheering you on (lol transsistor),0
3078,9044,"Have fun with your crippling sexual insecurity, I guess.",0
3079,17152,"This is me, 2 seconds after reading this post... 'What a tosser for playing such a gay game.' (only joking).",0
3081,1827,too big for your damn britches smdh stupid faggot smh,1
3085,40520,"No matter, your gender, culture, class, race or creed, LOVE is for all and never discriminates!",0
3090,38376,"Call me what i am, a dirty faggot whore sissy slut xxx",0
3092,3723,I like pride month personally bc I take a lot of pride in being a lesbian and surviving my detransition process/figuring out who I am,0
3093,19341,"The first words out of my dads mouth when I told him I was trans were ""well no wonder you liked Mulan so much!""",0
3100,6662,"Hm, i think bicurious would fit you more for the time being! But if you really feel it suits you go for it!",0
3102,16325,I'm also bi so I just want to say that my love and support is going to you! 💜💜,0
3103,41838,Offset is a homophobe and serial Cheater. 💁,0
3104,1221,"Sorry, me, an intellectual lesbian prefers DRAGON DICKS.",0
3106,3177,"No, it means you're developing a black man dick which means it will get bigger! Congratulations!",0
3107,18044,Homo's hate Him This man sucked 20  dicks in an hour  Just by looking at them!,0
3109,5570,Typical shitty meme from a faggot,1
3110,11919,That's what a fucked up faggot brain does to you,1
3111,7908,Hey tbh it's okay if you like 1 or both genders it's the fact that if it makes you happy,0
3118,36236,Guess he will be in Chicago were gay pride on the 5th of July those who want to set up appointments im me ,0
3119,17811,/r/bisexual is proud to have this woman as one of our famous bisexuals.,0
3120,11649,Pretty sad if you can only relate with people of the same gender and race as yourself,0
3123,42482,Gay ass normies,0
3125,35321,"ive been told ""shut up faggot"" twice today and it isn't even noon",0
3127,22680,@rosehuffleboy @paramourer FAG,1
3128,33166,@noobbuddy The lgbtq+ community is full of pedos.,1
3129,19003,cause ur fucking gay thats why,0
3130,40524,What!!!!! The first transgender that you meet is this fabulous queen wow.,0
3131,48016,Now it's THE TRY GAYS,0
3133,16350,Thank you! I talked to a couple beautiful women and got to be a lesbian fairy godmother and caught a pair of pants!,0
3136,8066,This faggot needs to kill himself already,1
3137,44662,@ThatOneSevie I'm not even a Christian I hate God but I also hate these homos who are ruining our society,1
3138,45107,Kawhis a fag,1
3140,21937,Hungry ass faggot ,1
3141,13165,"Yea it's kinda gay, you can't post about the most controversial topics like race, etc.",0
3144,40700,Twitch is gay.,0
3146,40625,Maybe I'm just being gay but she's adorable 💖💖,0
3147,17378,Representation in all forms gives trans women a bigger voice to enact change in the world. Good for her!,0
3149,8218,Hila is so pretty with that hair and the beany I can't.(I'm gay don't worry),0
3150,14132,"Yay, bisexuals of Reddit unite 😊! And I think QUILTBAG is funny to say haha",0
3152,29750,why are white transes like this lmaooooooooooooo also don't think we forgot about you posting yourself in blackface bitch gtfo ,1
3155,9569,Lmk when you kys faggot omegalul,1
3159,22672,INTERSEX CUPS FOR PRIDE 😩❤️ @PrideInLondon @BudweiserUK ,0
3160,3042,What a bunch of fags.,1
3165,40535,total faggot schaub.,1
3170,43888,"Gays are like Vegans; They always gotta tell the world about it. NO ONE CARES, FAGGOT 🤣",1
3171,20475,That AIDs weigh a ton nigga ,1
3172,17953,Make me cock sucker,1
3174,26853,To all of my LGBTQ friends and loves: Happy Pride! Love Is Love,0
3175,8234,"No the actual resistance to gay marriage was based on religion, idiot.",0
3176,22281,YG got a bad bitch you stupid!? #4Real4Real #BottleService.,1
3177,13517,LGBTQ+ sourced are grasping at straws? Lmao okay bud.,0
3179,47749,Go suck dick faget and kill both your mommy's,1
3182,11902,Every single one of is a fucking idiot. Cause you are killing yourself each hour. If you don't give me your money you are gay,0
3183,10427,This post is triple gay,0
3187,407,"Fuck you E-Boulder, nice podcast you fat faggot.",1
3188,19508,And youre probably a degenerate poofter,1
3192,7175,YouTube should ban both of them for being huge faggots,1
3194,6334,You sound like quite the massive faggot.,1
3195,16011,Maybe the Lion was too busy building that homosexual night club to notice,0
3197,3068,MGTOW is fucking gay why don't you just castrate yourself,1
3200,18950,Wtf are you talking about you faggot? Don't be mad at me just cause you have a crap life you fucking cunt,1
3201,8458,homophobia is so 2008,0
3202,5661,You're a homosexual if you **haven't** dreamt of sucking the sweat out of Riley's ass hairs,0
3205,37357,@SoapIsWashed Faggot,1
3207,20175,ten is disgusting. i hate gay people,1
3213,4465,Talk about a massive faggot,1
3215,11775,"Alroighty so fuck em all and call them all faggots, agreed.",1
3218,12359,"Let's ass blast this bitch into the front page, faggot",1
3223,3777,"Right??? Thank you! I'm not a lesbian, I'm just a girl with tattoos and I appreciate your sentiment lol.",0
3224,8099,You look like a lesbian getting ready to head out to a rally.,0
3225,2951,According to Leftists I'm also homophobic and transphobic because I'm not willing to suck on either genders cock.,0
3226,42644,"Congrats, FAGGOT! gtfo",1
3227,3571,"Pride month isn't only for trans people, and we do it because we want to be treated as equals",0
3228,7110,No the hardest part about being a lesbian is dealing with men lol,0
