id,text,anti_lgbt
1941,49773,I just wanted to see idubbz say am gay but this is better,0
1942,49217,WITH NO FEMINISM OR LGBTHSGHDJDGSVXHDBULLSHIT THIS IS GOING TO BE A SUCCESS.,0
1946,42506,Y the fuck is this showing up on my feed fucking fags,1
1948,9946,I feel a little more comfortable around queer people because they usually get it but everybody else kinda treats me normally.,0
1949,5360,Fellow trans girl here! Love and support confirmed!,0
1950,37426,This bitch is beyond retarded,1
1956,20764,imagine fixing the entire timeline was just kissing ur s/o the gays are rlly that powerful,0
1958,20869,I appreciate being bilingual with both African American Vernacular English and corporate white American English,0
1959,45522,Do not attack Iran Donna Jane Trump you piece of fucking tranny shit!,1
1960,5027,Whack that fag,1
1961,169,Only came here to downvote homophobic comments,0
1962,27075,I'm not letting go of the lesbian ribbon despite changing my icon a lot ahshdh,0
1963,41385,This is gay I dont see mushu,0
1968,15924,Typical reddit faggot,1
1969,15226,Me!!!! And my wife. We are LGBTQ allies . And we are atheist. Well we believe in Harry Potter but that's another story.,0
1971,25211,@gaywonk @YouTube Shut your faggot beaner ass up,1
1973,3152,You have to be a special type of pathetic faggot to use masstagger.,0
1975,9167,Found the faggot,1
1976,14315,hey as a lebanese non-binary person this is hilarious and adorable.,0
1978,37908,"Ahhh yes, the gays strike again.  Bitch wtf ",1
1980,15571,I dont speak english coming out of the mouth of self righteous neck bearded faggots,1
1983,19697,So this is what a chapo fag looks like without their sheep's clothing...,1
1984,4069,le homophobe has arrived gtfo,0
1985,18086,Oath sister!! I love the gays,0
1986,5317,Asexuals are not fags.,0
1987,46507,I feel this collab is for LGBT community... Thanks for this Ed/justin,0
1988,43311,What a fagget,1
1989,19896,Its so scary to transition while in a relationship. Im doing it to but Im with a cisguy and I'm a trans guy.,0
1990,47146,Antifa is nothing but gays that sit around fingering each other in there assholes,1
1991,24818,i need new lgbt+ mutuals... if you want rt this please so I can find new ones?,0
1992,18081,"Wow this thread is wild full of transphobia, homophobia and misandry. Thanks for showing y'all's true colors",0
1993,14325,"That's why God created the Remington bolt-action rifle, so that Man could fight the dinosaurs. And the homosexuals.",1
1997,4923,Gay guys are guys just the same. Just because some of us act like queens doesn't mean we aren't men.,0
1999,46996,They look gay in a f__k up gay world. cover your booty cheeks next time,0
2005,11535,Who cares what she has to say? She has big cock-sucking lips.,0
2006,10583,The biggest homophobes are always the first to suck truck stop dick.,0
2007,20323,"I mean yall r okay w gay celebrity couples but not w a real life gay couples, so what u tryna say again?",0
2012,23485,"My bisexuality consists mainly in thirsting over men in skirts, dresses and makeup in women in suits, muscles and holding enormous swords",0
2013,24397,"""You're an annoying fag so you should do great,"" said Knuckles.",0
2014,9011,Fake: anon goes outside Gay: anon gets one upped by a chad,0
2019,27862,@boombithc That's what you get for being a faggot,1
2020,15052,Would you be interested in a bisexual crossdresser. I give great head and would love to relieve your tensions. My fem name is Amber,0
2022,43510,Go suck a dick and stop pretending to be an American,1
2027,13983,that kid is homophobic,0
2031,11822,You stupid retarded bitch,1
2032,40239,I feel the prisoned sheep is gay. Cuz it has the gay flag colour,0
2034,3375,"dGayWisher Hey gDayWisher, I hope you can fuck right off,you IQ deficient robot",0
2036,14648,Such a trashy little faggot,1
2037,16900,This is 4chan not watchredditdie Post your faggotry elsewhere fag,1
2039,3448,Are trans girls welcome?,0
2040,43222,Hooray real woman wins versus Trans,1
2041,14092,"If you have to ask then kill yourself, faggot.",1
2042,8535,inpuza why do you like LGBTQ+ and u r polygender and a bit of everything???? u a weirdo,0
2043,1264,Fuck off gay bitch,1
2046,24647,Anthony is a Gay Faggot! Shut up you Whore!,1
2047,19491,How do you view lesbian relationships?  IN HD,0
2049,6501,"Commit suicide yourself, you cock sucking faggot ass bot. That'd send a message.",1
2052,11880,Shut the fuck up faggots,1
2054,4010,"Yeah, well you're r/sounding like a fag",1
2055,7444,"If you think people can't magically change their gender, and the fact that people aren't already doing so, then you are pretty damn deluded.",0
2056,13194,Yo fuk that bitch,1
2057,6375,Your stupid fucking bitch,1
2059,14260,"""I love my three gay dads"" - Ms Marvel",0
2060,41081,Throw that faggot in boiled water!,1
2062,25692,@Jared_Carrabis You catch nuts in your face faggot,1
2063,49534,Wonderful Fabulous News!!! Gay Marriage Pride dears!,0
2064,33925,That's a deadly fagot!,1
2067,11999,Can we throw gay characters off roofs in the name of Allah?,0
2072,1664,Thank you fellow lgbt you are valid as well,0
2073,24620,"no joke I cannot get over this, it's one of the gayest and best things that has ever happened to me H E L P",0
2074,7392,"I agree. It's nice that science validates the existence of trans people, but I'd support then anyway.  Your happiness is what matters.",0
2076,15489,"Alright thanks, faggot.",1
2078,46109,+itchy robot LOL what's the matter faggot homosexual cum guzzling sperm baby you looking for attention?  fucking queer,1
2079,6309,Then leave you faggot,1
2080,44644,His son is gay! Right? And really freaking ugly laugh!!,0
2081,16293,"My mom doesn't accept me being bi, we're on decent terms but we just never talk about it",0
2082,47214,Play Minecraft to make the gay fortnite players mad,1
2084,42653,Jaden exhibits all of the characteristics of a gay Psychopath. Fact. Millennial Icon.,0
2086,27848,i love being gay wjth my friends,0
2087,392,grow up faggot,1
2089,43593,Are you still gay ?,0
2090,17884,"These faggots are trashes every way , trashing the whole place wow",1
2091,4681,"This is a weird way to celebrate pride month, but you do you Indonesia",0
2092,1779,as a gal who goes to tournaments. a lot of people don't care about my gender that often.,0
2094,33798,Scamer.terrortust damn bukice fagot.,1
2095,25366,The way writers have lesbians speak in code when they want to fuck is so cringe,0
2098,22598,Happy pride month you're all going to hell,0
2101,41185,Another Ghostbusters remake that will fail with LGBT agenda. #Boycott,0
2103,41858,Why is it we don't see women attempting to transgender to men ( as if this really was possible ) and competing in men's sports events.........,1
2105,23019,this just in: ur mom gay,0
2107,43084,Is she gay,0
2108,41380,@Dewin Vega shut up faggot you don't know what the fuck you're talking about queer,1
2109,13422,"A comedian, huh? Fuck off, I have no time for your insane faggotry",1
2110,12549,Fuck you you stupid mentally I'll bitch.,1
2112,19502,eat shit aussie faggot,1
2114,17950,"Hey, retarded faggot, go suck a dick.",1
2116,35250,@loonavic @louvrelot @Precuuming bitch fuck you and your nipple you smelly bitch,1
2117,11696,I hate lesbians I hate homosexuality.,1
2118,9904,How long till ur balls finally drop after I'm done sodomizing ur sister u cuckold faggot!!!!!!,1
2121,8085,Are you saying we should burn lesbians at the stake?,0
2122,1698,shut the fuck up summerfag,1
2125,3058,Honestly? Reminisce about the father I had before she went transgender.,0
2127,19532,"> ridding  Nice word, faggot WHY DONT YOU FUCKEN FIGHT ME",1
2128,49522,Grandma and Granddad reunite to save there daughter from becoming a lesbian there i summed up the movie for you thank me later 😎😉,0
2129,23500,Fucks sake. He's up and stinking my house out with fags,0
2131,25708,"friendly reminder that peter parker is trans and we support him no matter what! happy pride, spider-man! 🌈 ",0
2132,6176,It's more that the kind of people who would actually go to or care about a straight pride parade are likely doing it to mock gay people.,0
2135,17185,I need to start meeting other trans people in real life.,0
2139,18947,Being transphobic isn't cool or edgy. Just makes you a dick.,0
2141,17465,only if it's for gay vampires,0
2142,6271,😂😂😂If my son was as gay as you I'd shoot drown em in the tub. Faggot,1
2143,6998,"You faggots are ever so consistently annoying with your bullshit. Always something to cunt about, seemingly.. fuck off.",1
2145,46644,"And you just wrote a whole fuckin paragraph in response to me, so fuck off you faggot loving dumbass",1
2146,23498,why did my mom never tell me my grandpas sister AND brother were gay this is erasure!!!!!!!!!,0
2147,42429,he looks alien and a gay,0
2148,33833,Castration is the only solution for people like you.,1
2149,19593,*laughs in killing apostates and oppressing gays and women*,0
2150,11244,how do you feel about trans girls?,0
2151,9108,I hope he mauls your retarded faggot of a son bud,1
2155,16703,That's because you're a faggot.,1
2158,4989,What faggots.,1
2159,8270,What a bunch of liberal faggots,1
2160,13582,he might be a faggot,1
2165,4011,"Fuck white supremacists, homophobes, misogynists, and ignoramuses.",0
2166,20802,"if yall want a good enough lesbian movie tho.. watch""Below her mouth"" 😏",0
2167,720,I respect this mtf transition,0
2169,14063,No thanks homo,1
2171,42234,the gender pay gap has been proven false on so many different occasions why is it still a political talking point.,0
2173,2372,he did the right thing. imagine all that faggotry crossing SPECIES.,1
2180,4023,"Why? It's never even hinted that being gay or bi means you end up in the Bad Place, if that's what you meant?",0
2181,46731,Bro there is a reason why is my fav rapper and when he go hard with it he really goes hard with it!!!!! I love u bro no homo,1
2182,19339,You would fuck a tranny?,1
2184,6492,That is a lesbian and you can't tell me otherwise,0
2187,15520,"This story only makes me even happier that I am single, and also gay.",0
2188,42681,Gay means that a boy loves other boys,0
2190,39025,are you cherry emoji twitter or are you bisexual,0
2191,12947,"Lol, ""Sodomite""? Do you get your hateful language exclusively from the Bible, or are you just that old?",0
2193,2210,"But that means LGBT+ support is popular now, which is good.",0
2194,41108,"Our team is pretty good buuuuut not everyone is lesbian, some of the players are married to men.",0
2195,17575,My god those niggers are worse than faggots.,1
2196,26344,@NumanAfifi @LatheefaKoya Queers dont have rights. They should be rounded up and put in a concentration camps,1
2197,8436,thin skinned pansy cunt,1
2199,22856,I've decided I'm straight just in time for pride month. Give me all the footballs and boobies please and thank you...,0
2200,1627,Dude same I didn't even know being bi was a thing. Life has made so much more sense ever since lol,0
2202,10597,So youre not really anti lgbt?,0
2205,1579,you one gay ass nigga. You make me wanna puke and then suffocate on it!,1
2206,1674,Look at this faggot.,1
2208,17158,"What are you on about, you tedious faggot?",1
2212,3689,Straight trans people are ok and we must legally thank them for their service,0
2213,4937,Fucking gay fuck them,1
2214,47936,Trans Rights! hell yeah,0
2216,28686,Women with masculine spirits are trash.,1
2219,1761,You dumb fag I didn't attack anyone. Wtf is your problem?,0
2222,41696,"Careful Canada, Saudi's behead Gays.  Perhaps it makes no difference for Canadians who don't use their head.",0
2223,43257,"I've Got Your ""Hostile Takeover"" You Homo Queen Schmuck. Pow!",1
2224,32536,Trans Ballerina Jayna Ledford Is Shattering Stereotypes ,0
2226,15093,Go beg on the street faggot,1
2229,237,I wanna beat your bovine grass grazing face just because you shave your legs faggot,1
2230,10777,"It's not just Poland, in many other countries, including Romania, Pride is called The March for Equality.",0
2233,8275,"""Useless piece of gay shit"" would match better.",1
2234,2903,The only ones killing trannies are themselves,1
2235,8078,"Snowflakes.  Zero mental toughness.  Complete pussies.  ""You better not offend me or hurt my feelings"".",1
2236,43430,"Happy trans day of visibility buddy, I've celebrated by going to my local transgender pride, protesting our rights.",0
2237,22493,i hate this fag so much ,1
2238,7171,"Are you trying to make fun of this dude, you fag?",1
2239,26159,Gay PRIDE THIS YEAR HAS EVERYONE COMING OUT,0
2241,41974,So if I've spent way more time with my father doing more guy ish activities ive become a lesbian ? Lol,0
2242,10260,Fuck you stupid assholes downvoting with nothing to say. Bunch of fucking cuck faggots in here.,1
2243,17351,Find a degenerate tranny and stomp it's head into the ground. That will be much more effective at triggering them.,1
2245,22994,it's a great day to be gay here at chick fil a. happy pride month from your fave bi-con 💖💜💙,0
2246,489,Oh look at the retarded one who should have been aborted.,1
2247,8325,Old faggot hates young faggot. Way she goes.,1
2248,17453,I'm bi. I never really thought about it too hard until the LGBT movement started gaining more steam,0
2252,13869,"Ah yes, trans people didnt exist until *checks watch* right now",0
2253,40707,BTW IM A GIRL AND I LIKE GIRLS SO YOUR NOT ALOWN,0
2254,43584,+Carlos Ramirez saying what ?? What were you trying to say?? Cause right now you sound like a homophobic,0
2255,7172,When girls have a bigger dick than me.,0
2256,9138,That's a peach of an ass I'd love to fuck her,0
2258,16186,If she had a dick i would suck it,0
2259,49556,Ppl who hit dislike are gay,0
2265,7146,i will not be your friend faggot,1
2266,44736,this some sort of pride parade only the LGBT community take part in street parades,0
2268,22518,Although I don't agree with everything in the LGBTQ community I know it's not right that they are treated!,0
2271,16367,That people think they can choose their own sex/gender. (Or claiming that sex and gender are different),0
2274,3760,Reddit is for faggots. It was only a matter of time.,1
2276,46179,"Yet in chruches here in the european countries,Gay people are getting married.",0
2279,12657,"""Eating pussy - God thats so gay"" Every retard ever.",0
2283,46637,This video just goes out to show the respect for LGBT COMMUNITY!,0
2284,3952,"I would've never guessed that you were trans, you look so good",0
2285,18549,yeah thats what happens when your radical violent terroristic ideology causes tragedies like the ice facility bombing and the dayton shooter! lol fags,1
2286,18145,I was hoping this was just a thumbnail prank. You're a real piece of shit and a faggot by proxy,1
2288,7086,Post your dick in my ass faggot,1
2289,21950,all gays = shotgun. fuck off too all,0
2291,28303,Only faggots delete posts,1
2292,9856,Learn a different character faggot,1
2293,18325,He probably found out he was gay too on the trip and leaves to live with his yak lover.,0
2294,49178,rapinoe is a skank dyke lesbo piece of shit,1
2296,17404,I hope they wont. That would be fucking gay. Fuck you fucking enviromentalist piece of gay shit,1
2297,44675,I hope they all get AIDS. That would be HILARIOUS!!!,1
2298,4333,I bet you suck good dick don't ya little boy,1
2299,5205,Someone dose this gaylord with a few tabs of LSD. Maybe then he'll finally realize how gay his chain looks on him.,1
2300,46546,What a faget,1
2303,47559,I agree w everything but the last part. I truly think only Trans people should play trans roles if what you're reaching for is an authentic interpretation.,0
2304,37500,this fucking faggot is annoying,1
2305,25808,"oh, hi, why are Black trans women in Dallas being murdered and why isn't law enforcement doing anything about it? ",0
2306,785,"I've heard from some other sources, he's also a huge faggot.",1
2308,13577,"Local tried trans mom, can relate. 😑",0
2309,44787,who gives a fuck about this homo?,1
2310,12797,fuck you lesbian pieces of shit,1
2311,4307,This is probably the happiest the blank says trans rights meme has made me,0
2312,18513,"Fuck you, you fucking retard incest baby.",1
2314,18931,"Good luck hun, from one bisexual to another ❤️",0
2318,44850,Finn looks gay asf,1
2322,6178,"Serving black girl magic, melanin goddess, nubian queen realness good LORT.",0
2323,24188,like they'll lick each other's arseholes and throw up and drink each other's sick for banter but call people fags,1
2324,15651,"Yes, there is no small amount of misogyny in the gay male population.",0
2328,26988,@AYEVERB get a f#ck ING job u bum ass faggot,1
2330,27606,@JKCorden And yet some people still don't feel that educating young people about the LGBT community is important 😡😡,0
2331,8010,"nothing wrong with a bunch of homos on crotch rockets, calamari race ream is best race team",0
2332,18003,Gay more chicks and slaughter every one that doesn't have a number,0
2333,42401,You are a f#cking faggot Chris,1
2334,28887,Fuck all you city boy fagget's! Where all the pimps at ?,1
2335,15497,Bitch we all in the closet,0
2337,40970,the WTA has a transgender participation policy ,0
2338,3486,"Fuckin amazing, always posting the best shit! Interracial lesbian is always amazing",0
2339,2748,This isn't unpopular. The only people who think that kids should choose their gender are the vocal minority who has an impressive amount of chromosomes.,0
2340,45382,WHY YOU FAGGOTS STILL WATCHING THIS,1
2342,13841,Is America going to elect a gay man with butt in his name? try and be less moronic Americans. Fucking clown show.,0
2343,294,These dumbasses forgot how gays are murdered in Gaza and the West Bank.,0
2344,48845,"i thought gays get an instant ticket to hell from ""god"" without question",0
2345,18651,Retarded cunt,1
2346,4516,It honestly always surprises me when I see a trans meme on a non-trans sub But I'm glad y'all are fine with us,0
2348,5253,Pride month? Pride in what? There is nothing pride-worthy in just being attracted differently.,0
2349,8859,"Oh no, bike riding faggots are gonna get me for burning some cloth.",1
2351,11854,Shut the fuck up retarded ass faggot redditor,1
2353,11742,What faggots all of them,1
2355,17110,Put another wig on you queer little old man,1
2356,563,"I can relate 100% to what you said. Not trans, happy being a girl, but it sounds convenient and fun to have a penis.",0
2357,17494,"What are you? A gay retard huh gay retard u/NuttyNutsauce post Instagram worthy memes, you pile of fish shit",1
2358,302,You're a grown-ass adult who uses homophobic slurs and tells people to kill themselves apparently so idk man.,0
2360,21032,I'm so disappointed. A teacher said to me that a lgbt community is breaking human psyche.,0
2362,22465,"""sit down you little faggot """,1
2365,8478,fuck yourself bitch.,1
2367,43635,please stop this queer feminist bullshit,1
2368,4918,Yeah well fuck those lesbian niggers.,1
2370,13342,Go fuck yourself gay cunt,1
2375,48534,This fucking thumbnail is gay so are you guys u fucking fags,1
2376,4334,This has to be the gayest thing I have ever seen,0
2378,1046,Some gay guy that blew up or something,0
2379,29681,Glenn Beck is comparing the USWNT and LGBT stuff to Sodom and Gomorrah on the radio this morning,0
2382,19439,PEEN SUCKING FAGOT IDIOT DUCHBAG,1
2384,7383,I don't speak for trans people but i think that it's hard to love yourself when you don't feel like your body is the correct one,0
2385,38037,Support Black Trans youth ,0
2386,18219,Watch out for their gay roller skating prostitutes tho,0
2387,33255,I really dislike when people weaponize the Bible,0
2389,44292,That stupid dyke should be hung from a tree ASAP!,1
2390,10835,You can go suck a diseased dick faggot,1
2392,41594,Fagot. Dye his hair like a dam troll.,1
2395,45562,Reverse the gender: a bunch of old dudes and a 17 year old girl,0
2396,4729,God hates the gays.,1
2401,47172,Pride pin.. shit gay people are honestly degenerate retards,1
2402,48643,Lesbian homie pt 7 waiting to see the next chapter,0
2404,16372,"I don't have a problem with gay people. Manly gay is fine, faggy gay is bad.",1
2405,12054,Black men sing love songs and can be romantic. Look at Marvin Gaye,0
2407,48960,Fuck off gay boy is raptors year,1
2409,9737,A movie directed by a trans person,0
2410,41761,Proud lgbt trump supporter here! Can't wait for trump to deport these criminals and start making our country safer. Trump 2020!,0
2412,24922,bitches not even lesbians in mississippi. fake ass lesbians. bitches suck more dick than a prostitute. 😒😂,1
2413,37974,2019 opened my eyes to my sexuality.. now idk how to come out to my family :( #bisexual,0
2415,8497,Fuck tthat schizo dox those fags,1
2416,342,almost like most trannies are utter failures at being men and choose to take the easy road of being a woman in current year,1
2417,26947,"White gays be like ""white STRAIGHT men"" to remove accountability for themselves",0
2418,15952,Dip me in honey and throw me to the lesbians!,0
2419,8875,commentary gay,0
2421,11608,dump her you fucking faggot,1
2423,22766,"friendly reminder pt. 2: stop using bisexual girls to fulfill ur threesome fantasy, ur gross and i hate u",0
2425,630,What do you call a female incel? Maybe DID or dyke in denial.,1
2426,27237,I took ONE look at him and I can see he's gay! #tohavecharlotte,0
2428,9433,How about you suck my ass? fag,1
2432,4233,The r/bisexual subreddit is also very welcoming to straight allies and all of us love supportive parents.,0
2433,14206,Pussy is a homophobic slur now?,0
2435,18291,GET THE FUCK OFF ME FAGGOT,1
2438,28269,A stick and poke is what Brooklyn gays call sex.,0
2440,5483,Dont got worry bout shit when your self employed and eating crab legs and steak at home. Your gay autist go eat your nightly can of beans,0
2442,13615,"Well gender is a social construct, but sky is actually blue.",0
2445,6729,go back to paradise you faggot,1
2447,14342,Was thinking the same thing. Gay mods are at it again,0
2451,5452,"So very, very happy to see you as the real you. It only took me 49 years. Sincerely, The Gay Grandpa.",0
2452,46854,my lesbian hero oop <3,0
2453,16760,you're a fag r/sounding,1
2456,7846,Eh treat that filthy slut like the nasty beater bitch she is,1
2457,12598,"The difference is, other trans people will actually object to their actions and not encourage and make excuses for it.",0
2459,16832,Comes from the guy who loves to suck fags.,1
2462,36940,@jaketapper you are a fucking douche how can you constantly suck dick and not call yourself a fag,1
2463,2322,That's cute. I love seeing gay couples together. Love always finds a way.,0
2464,37280,this is so homophobic i have no number neighbours what even 😡,0
2465,12982,I bet he had shit on his dick from your dirty wh--i--te ass. You disgusting piece of wh--i--te shit.,1
2469,35855,The faggot is a retard as well I see,1
2470,32090,I never knew how popular or influential being gay was.,0
2472,23665,@_bacongod_ Boi shut yo bitch ass up I will smacc yo silly ass you fag,1
2473,39377,"I'm so glad I ain't mixed up in the gay community here, shit sounds & looks DRAINING. 🥴",0
2477,22832,"It's always Pride Month at my house Pan, Rainbow and Trans flag always there to greet you ",0
2478,13950,Nice thread faggot,1
2479,26901,"Pride month is Celebrating The GBTQ+ community apparently  Fuck us lesbians, apparently.",0
2482,3651,Homos are killing themselves in a alarming high rate how this shouldn't be a disorder.,1
2483,490,If you wanna stoop low I'll stoop low. Suck my sweaty cock n balls you stupid twink,1
2486,10739,kill yourself tranny lol,1
2488,19822,I've been getting better ever since I came out as gay to my family. I think it just boosted my confidence and now I'm a bit better,0
2490,5329,"Ben Franklin is transitioning to womynhood, you bigot!",0
2492,46554,Blame gays and Democrats. If you dont understand mass shoot yourself,0
2493,44225,@Jose Santiago choke on a dick faggot,1
2494,1308,I bet you can go fuck yourself cunt,1
2497,18387,"As a bi trans, I fondly approve of this",0
2499,42454,You are a tranny too?,1
2502,17330,"Edgelords and pretentious teens, the two genders.",0
2503,847,"How is the lgbt one for ""edgy neckbeards"" exactly?",0
2504,6947,You should join the trans girl groups (e.g. Duck Tales) on Telegram to get more localized friendship and advice.,0
2506,23012,"It's sad that LGBT rights are a political issue. It should be basic, granted, given! But I am loving this from Taylor Swift!! ",0
2507,48275,STOP CASTING WOMEN WHO LOOK LIKE MEN JUST STOP IT,1
2508,7507,"OP you look like a gay pornstar ngl, also, lol @ your receded chin and long midface, and long philtrum",1
2509,2728,Fucking unfunny faggot. If I saw that kid irl I'd fucking bash his face in.,1
2511,10385,"As another trans person, you're welcome xo :)",0
2512,18467,Don't worry man. A lot of dance teachers here are very openly gay and a lot of students from my school are as well :),0
2517,22815,happy pride month bisexual erasure is real and prevalent,0
2527,9271,I'm sick and tired of that motherfuckin' motherfuckin' nigger faggot!,1
2528,710,Epic games more like epic gays gottem,0
2530,42090,This bitch is nothing but a fucking CUNT!,1
2532,8227,Suck on dicks,1
2533,4313,This is so cute. Happy pride month everybody. today is my official coming out of the closet as bi!,0
2535,6841,That's awesome! I'm also bi and my bday is on June 1 lol,0
2536,49663,"The ""Trans Monster"" is public enemy #1",1
2537,18793,"Pretty sure this is how lesbians send ""dick pics""",0
2539,14396,You will never meet a woman with bigger tits than you,0
