id,text,anti_lgbt
1334,13494,"Don't worry, I'm sure social justice morons will create an Iron Woman, lesbian of course.",0
1335,22952,Homophobia is winning again... this world is a piece of 💩,0
1336,12942,Literally just getting drunk men to buy me drinks at the bar. I was one happy trans girl that night :),0
1339,3013,Haha you're a fucking fag,1
1341,16219,I mean at religious ceremonies there's the haldi kumkum for everyone regardless of gender.,0
1342,45488,I feel like I already knew he was gay but congratulations :),0
1344,45638,Fucking why is this faggot back on here,1
1345,15345,does it look like anyone here would give a second fuck about your gay ass opinion?,0
1346,28807,im bi which means i have a very specific type for men and i am in love with every woman on the face of the planet,0
1347,16141,Could autistic shits like you kill youself? Thx,1
1351,17398,And you deserve even more faggot. Eat shit.,1
1352,3739,"GF put a random lgbtq movie on, holy crap ""Holding the man"" made me cry",0
1356,17581,I still won't forgive victoria's secret for telling us trans women that we're basically ruining the name by wearing their clothing,0
1357,527,"To answer OP's question, phony ass SJW shills like these three, pretending like transgender people are normal. That makes me cringe.",0
1359,9655,I would eat that perfect shaved pussy all day all night. Then slide my cock in her wet slit after she cums on my throbbing cock..,0
1364,579,Been creeping in trans for 3 years,0
1365,9850,"YTA, you're a faggot and a disappointment to your ancestors and should not encourage such behaviour in other people",1
1368,9742,Ol faggot ass bitch,1
1372,35733,happy onf day a character in minseoks web drama has a BIG GAY CRUSH on minseoks character,0
1376,42688,Keem: Everyone is cool with this Chat: this kid is so gay,0
1379,43863,america is gay,0
1381,7399,We need more gender non conforming transfemme people. Do what you want and be your best self! We're all rooting for you :),0
1382,17272,Fuck this little midget faggot.,1
1384,3610,Why are all non-binary people biologically female? I haven't encountered a single non-binary male so far.,0
1386,348,"Men is so fck Hot, i can't roast her XD But i can say, start working on a REAL job faggot",0
1387,42802,Gay people are disgusting :),1
1390,17721,gay communists,0
1393,43509,Well everyone is technically biracial its the degrees of differences...she looks like a standard old lady possibly of European descent.,0
1394,16903,Kill yourself fag,1
1395,4030,Congrats on the trans girl,0
1398,22657,Black trans women in Middle Eastern countries don't have a life expectancy at all. ,0
1399,21580,me: let cris soto say she's bisexual you cowards skam españa: hold my beer ,0
1400,22241,Gay mother responds to 'anti-LGBT+' protest leader outside school in Birmingham ,0
1402,42671,Funny how people made a big deal about the little mermaid being black but no one had a problem with mj being black.,0
1404,13453,"Yes. I am in fact trans. Thanks for noticing, comic.",0
1405,43507,butthurt queer,1
1407,5700,"Hey, idk if it might help, but I'm queer and Catholic. PM if you wanna chat!",0
1409,44658,This is inspiring! Good project and nice video showing the struggles of most members of the LGBTQ Community ♥,0
1411,22441,responds again you were powerful the filthy fucking faggot.,1
1412,41026,Transgender is a mental disorder and so is homosexual.,1
1413,3297,"Not my fault you can't read, faggot.",1
1415,40941,Canuck fans r gay lebitchs lol,0
1416,42625,Fuck sake who cares if you're gay just cook my meal,0
1417,46779,Wahmins can do anything. Gender is a social construct. Can't the dumb feminists get their message strait?,0
1418,19577,You guys need to look up what bitching means. Homophobic too while you're at it.,0
1420,4546,"Y'all both some faggots. Go dick each other down, and move on. Fags.",1
1421,2932,"Oh hey, Same! Yeah it's hardly a welcoming environment for queerness, but you got this.",0
1422,15880,As a transwoman I hope I get to be a girlfriend for the first time by next national gf day,0
1423,16238,>Just look at what female birth control does to women Does what? Either way they'd still be foids.,1
1424,9259,>toxic You talk like a fag. Have you removed this females value?,1
1425,45091,Chick filet is homophobic,0
1426,23728,37 my ass fuckin faggot,1
1427,41127,Hopefully all the illegals and libhomos died,1
1429,2598,Mods aren't even gay anymore. Mods strait up asexual...,0
1432,27409,You bitches are disgusting. OnG hope yall get shot,1
1434,47765,This bitch is retarded!,1
1437,46477,"Jc Stang The big 3, employment, housing & medicine. LGBT can be legally discriminated in many states.",0
1438,15359,Bi guy here and love it too!,0
1441,2415,Lmao im a lesbian too. Its just something ive picked up on. No one ever mentions the black male Li being their favorite,0
1442,17021,"Neither will you, ever. Faggot",1
1443,13731,I've never been this happy to be bi.,0
1444,46814,fav gay dude. But thank you. Jeffere's vid and then James it was all off putting.,0
1446,8656,So men's Capri pants are officially not gay anymore eh?,0
1447,1570,You ain't finna do shit dumb faggot,1
1449,9170,Let's call it heteroflexible.,0
1450,13012,Eat dick and die bitch xD go cry somewhere else,1
1451,42803,Popcorn Seller hypnosis is a scam and homophobia is idiotic,0
1453,47607,U guys suck dick and no one likes your fag assess stupid bitch,1
1454,40131,Fuck you queers you ain't coming to my city cuz we hate you people will fucking kill you and sleep good at night,1
1457,9683,Hope you die of cancer you fag,1
1458,47431,+itchy robot I'm going to take a wild guess and I'm probably 100% right but you're nothing but a faget homosexual,1
1460,42521,To be honest the whole pride month thing is kind of annoying all I see in the train is guys with no shirts on with their nipples covered in glitter,0
1462,6715,!flair [death to all niggers and gays],1
1467,49584,"Send all of these ""ladies"" back to mexico so they can fix that first.",1
1469,3151,All of these are right (except the baby killers maybe). You've probably definitely had gay and maybe trans teachers.,0
1471,1838,just want to say that you are an utter faggot and need to delete your account,1
1473,3385,"as a mongoloid man just shoot for the fucking moon, its time we do that to show these faggots the real hierarchies",1
1477,13326,Stop reposting faggot,1
1480,46343,Gay black man milks one hit wonder song for $$$ you've seen it first here folks,0
1485,14653,"Another gay hispanic, so usual. Fuck off and die. You know ull get in due to AA, so suck my small chinese cock.",1
1486,26044,Incel was made by a lesbian woman to describe misogynistic men are u insane,0
1487,9245,Almost as if their sexuality doesnt matter when they're fighting hoards of zombies 😂,0
1490,19597,These faggots cant wait their turn... smh,1
1491,16314,Burn in hell fag,1
1493,1096,"Not nonbinary, but I'm appreciative of the inclusiveness",0
1495,28521,FUCK your HOMOPHOBIC ASS.,0
1496,1012,"NTA - As a gay man, I thank you so much for standing up for your son.",0
1497,24156,And you're homophobic trash,0
1499,40647,What the fuck are you talking about you stupid fucking idiot.? You're probably not even an American so shut the fuck up queer.!,1
1500,12420,Look at that faggot,1
1501,10631,Always appreciate a good booty/whooty on any gender.,0
1504,14415,Why should we be proud of being men? Why is that something that necessitates pride?,0
1505,17588,"You should fuck off, you retarded twink twat",1
1507,28400,Gays arriving in hell seeing how generations of gays have renovated it after being told it would be nothing but fire and brimstone ,0
1508,8244,Reving up the engines for fags like you,1
1509,9052,Can't pay for that thousand dollar top or bottom surgery? Well no worries my trans friends!! Jump right in!,0
1510,25071,28. all my barbies were lesbians too but i just thought i was a very enthusiastic ally ,0
1512,40349,She still looks like an insecure sexually confused girl.,0
1514,4454,The comments are gross. What is it with homos that they see a group of boys and their minds immediately turn to sex.,1
1515,13748,Yeah! Give those homophobes a new language to learn!,0
1516,3309,"Fuck gay people, but don't dare be ableist /s",0
1517,42035,We need concentration camps for theses freaks,1
1519,42272,Hating on gays in theirs closets are ya now JackOLantern?,0
1526,20406,TONIGHT I'M GAY BOTH IN THE QUEER AND HAPPY WAY,0
1527,37334,lgbt stands for Let's be Gay for Butches and Trans rights,0
1529,23496,"in future, i need to just block or mute any convos that involve drawing lines between ""cis lesbian"" and ""trans man""",0
1530,21922,"The gays are getting stronger with every hour that passes until June, the gayest month",0
1532,18231,Fuck off homo fag,1
1534,49334,2:59 when your crush reveals to be transgender,0
1535,10541,Became gay after I fucked your mom.,0
1537,23057,A proud moment ror gay rights.,0
1541,44591,Shut the fuk up you non-american stupid ass queer choke on dick and die,1
1543,10797,I'm Greek Orthodox. It doesnt really impact my sexuality all too much. Still go to church for holidays .,0
1544,48197,Uhm... he's really gay and he does also drag sometimes .-. he is literally part of the drag community,0
1545,31881,I pieced most of what I know about heterosexual relationships from deodorant commercials,0
1546,19480,"Wait, people think you're gay if you recycle??? brb, emptying my recycling bin into the trash",0
1548,5933,Fuckin shoot the cunt,1
1552,616,Why are all you desert people so fucking gay?,0
1553,14479,"I'm biracial, African American mother, Eastern Slavic father, heterosexual, and movie and game ost's",0
1554,44636,7:39 best lesbian in the town,0
1555,43824,Who is this pussy ass beta male ? Looks like some soy drinking child molesting faggot,1
1556,2908,Own many and carry one every day. Armed gays dont get bashed,0
1558,4132,Fuck you mods I can't fucking post bunch of faggots,1
1559,11429,Eat my ass fag,1
1560,25583,"Please help support Asexual Trans Pride, add a #Twibbon now! ",0
1561,24266,@tariqnasheed These faggots are a bunch of degenerates,1
1562,6529,"Transgender people* (know you have good intentions, just helping you fine tune them)",0
1563,37456,fuck u and that bitch,1
1564,23547,#PrideMonth Happy gay month gays :D,0
1565,38935,Please help a trans girl in need this pride ,0
1568,44173,"So sad people couldn't get past the fact that he was gay, really glad times have changed and he's finally getting the respect he deserves",0
1569,44263,Why does being gay mean so much to gays?,0
1571,43789,Attack helicopter the best gender,0
1572,47222,they all seem pretty gay.,0
1573,46525,Holy ass you fucking faggot,1
1577,13596,"It's great to see them supporting LGBT, especially in difficult countries like Poland and Russia!",0
1578,13852,"Yes, I know. It's nice having people who don't scream slurs at you all the time for being LGBT or Jewish.",0
1584,47374,"Regardless of biology meaning color, gender wrong is wrong! hating on America and dividing our nation is wrong! Get the squad out!",0
1588,44034,Tell him the truth. Only black gangs have gays and punks. Only.,0
1590,3733,"I think that could be said of anybody, regardless of sexual orientation.",0
1591,2753,Another dumb gay slut,1
1592,19524,I'll give you a hint: trans people also have sex with cis people.,0
1594,13970,"By bending over backwards and sucking your own dick while rolling out of their house, in a show of independence and how gay you are.",0
1595,23709,grindr is making me homophobic,0
1596,2458,shut the fuck up you nigger-loving faggot.,1
1598,12749,Mods at r/greentext are fake and gay,0
1599,20076,@reIatived fag,1
1600,20307,@JarvisDupont Shut the fuck up faggot,1
1601,12886,"Why are all the lgbt subs filled with this type of shit? I just want a gay sub without cringey, immature teenagers everywhere.",0
1602,27422,trans rights! ,0
1604,9392,But gendered language like mansplaining is ok. Because only men can be guilty.,0
1607,3330,Cause he's a faggot who bows down to suck the dicks of terrorists,1
1608,33681,Trans girl is finally confidently to just go into piblic with natural make up ,0
1609,15451,Sylvando is so wonderful! He's camp in literally all the best ways and he makes me happy to be gay,0
1611,46330,Bi-racial lesbian...? Why did I feel like she shouldn't have to say that?,0
1613,8386,What a faggot.,0
1614,2642,"Shoot yourself in the head, retard",1
1615,47770,And people thought he was gay 💀,0
1617,37414,@nastyseventh Suck my dick faggot,1
1620,17960,#GAY BOI DETECTED,0
1621,20841,@kobe_Almonte @FaZeClan Shut up dumb ass dyke ass hoe,1
1623,33822,First Openly Gay MP Elected In Japan  via @yourgaynation #GayNation ,0
1625,27600,im bi and u should stan bts #LGBTQruletheworld ,0
1626,5704,"What a bunch of weak, sensitive fags. Lmao.",0
1628,3481,Imagine unironically watching that braindead tranny.,1
1629,643,Welcome to the group and congratulations on your self acceptance! I didn't come to recognize and accept being Bi until I was in my forties.,0
1630,4017,Cisgender  Thank you,0
1631,6157,Why do gay progressives make the fact they love sodomy the center of their existence?,0
1632,3473,"Just heard about homophobia, that shit sucks",0
1633,6586,I don't have any pride about being white. Mostly just relief.,0
1634,48354,Says the sperm guzzling homosexual,1
1636,44869,I'm here as a single heterosexual white American male to congratulate this beautiful athlete in her victory. Euro Pride,0
1637,3879,"No bitch, you're the whore here with AIDS lmfaooooooo you ugly filthy whore",1
1638,11946,Fuck off fags.,1
1639,19331,Suck homophobes off until they cum.,0
1642,35599,I killed fity men for my country and you voted for a gay nigger President twice? ,1
1647,10272,Exactly! LGBT representation is hard to do right but when it is you can tell and it's just EEEEEEEE. Thanks for being understanding though,0
1649,1859,I am transgender but I'm also mentally ill but it's still appreciated.,0
1651,19268,My aunt is trans and is more woman than you'll ever hope to be,0
1653,5137,Kill yourself reposting fag,1
1656,4929,"Oh, but according to them, everyone who isn't white and heterosexual is a degenerate!",0
1657,41086,LESBIAN JESUS IS BACK AND IM SO HAPPY,0
1658,6511,Every trans person now gets a free unicorn ~~frap~~,0
1659,19910,Whatever sister drastic times call for drastic measures and your gay dead ways are of the past now old man. Go top a twink,0
1660,804,##Who cares? ##Protect yourself with a Rifle and let them transgender themselves to death.,0
1663,2570,only fags play for paint cans,0
1665,44487,Women football is trash .. Rapinoe is a filthy lesbian .. Tel her to repent,1
1667,5747,Omg another transgirl aaaaah your so beautiful I'm also trans looking for trans friends,0
1669,18101,Don't forget the homosexuals,0
1670,30758,Berkeley voted to ban gendered language from pretty much all of its business around the city  ,0
1671,5929,I mean.... I'm aro/ace. So I guess that's kinda sorta gay because I like women the same as men,0
1673,11704,fucking lesbians. i will fuck you both into ass,1
1675,136,Suck a dick fag,1
1678,16918,This is it. I have finally come to understanding of my issues with gender and sexuality. I just wanna be cute.,0
1680,46115,Cory Booker is the worst thing to ever happen to the gay community.,0
1682,1699,"Same. Currently hoping that my current makeup of being Bi, gender-blind and open to just about anything and everything wins out.",0
1683,5340,gay women are the worst of the LGBT community without doubt they actually make me wanna throw up lmao,1
1691,8239,Stop lying and go fuck yourself faggot.,1
1692,7261,Right? I'm a bi girl and I love seeing tits. I'm not ashamed,0
1693,16567,What? Lmfao. Only 7% of the population is LGBTQ,0
1694,25004,carolmaria are lesbian wives who raised a child together 🥺🏳️‍🌈,0
1696,25839,@gaywonk Shut up faggot,1
1697,32978,love hearing an inferior fag bitch sub slut choke on an Alpha's dick...its music to my ears.. ,1
1699,11289,"Any way to remove you from the gene pool is a good way, cunt 👋",1
1703,16806,"Gay people still can't donate blood, even if they are virgins.",0
1704,8986,Try harder like your rome model sam hyde you dumbass faggot,1
1707,43363,Y'all are gay asf women ain't shit,0
1708,19756,You are the biggest fucking faggot on this planet...,1
1711,4528,"White pride, nothing wrong that. I'm proud to be white",0
1713,31928,@zeldro_ Hey faggot are we gonna hang out today,1
1721,4706,Take that faggot stuff somewhere else.,1
1723,45932,who watches anime . only gay people do,0
1726,10604,Pull up with the gays first to kill them so we can invade,1
1727,35671,Love how diverse the world of gender can be! #Femboi #Tg ,0
1728,9176,Imagine not eating pork because some pedo fag that died 2000 years ago said something about pigs one time,1
1730,4747,This post is mega gay cause it's a repost,0
1731,18445,More supportive of the LGBTQ+ community,0
1733,6623,"Maybe that's why he's the fastest, he gets away from gays fast as possible like a homophobe",0
1734,50008,+Professor Liberal Avenger why so ashamed of yourself? Why so afraid of reality? Welcome to biology class. There's only two genders.,0
1735,16517,Damn with how Reddit fags act morally superior to all I kinda doubt that,0
1736,44135,I was surprised they were showing respect to a white man...then I learned he was gay. That makes more sense.,0
1737,10389,fuck off faggot bot lmao,1
1738,9043,A massive thanks from a bi teen,0
1740,32907,Pussy ass how cud neva,1
1741,1407,mmmm would grope those tits as she sucks my throbbing cock in front of you,0
1742,7998,Fuck off you gay bitch and kill yourself,1
1743,46239,like a fag would ever play video games,1
1744,23766,is being trans valid? please retweet after voting for #pride,0
1745,5607,Can't wait to see you stroke that big cock and see it cum :)),0
1747,17729,Ah. I'm planning on coming out as trans (and I guess lesbian) hopefully this week. Good luck man,0
1748,17413,You don't have to be out for your bisexuality to be valid. Happy birthday!,0
1755,8528,Fucking faggot they deserve to burn in hell,1
1758,49687,Offset surrounded by gay niggas. Haha #offserforpridepresident,0
1762,10559,Lemme grab you by the pussy faggot 😏,1
1764,1795,Hitler is my gay sugar daddy and he shits in my mouth.,0
1765,42071,Subscribe if you're stupid asf and a faggot,1
1766,7464,Fuck outta here with this gay shit,1
1767,13121,As a gay male amazing cock love it wish i could have it in my ass at all times,0
1769,18932,"""Hey there guys, gals, and nonbinary pals!"" best greeting for this imo",0
1772,15712,Fuck off and go suck cock with all you other faggot friends,1
1773,8538,Homosexual rate drops to 0% because of lung cancer.,0
1777,23555,@gomentskki what a faggot,1
1778,45533,If my kid turns out to be gay and doesn't come out like this I'll be disappointed lol,0
1779,7589,"All i hear/see from you is ""i am a faggot, please punch me""",1
1780,25902,ATTN: Straight People. Don't be upset that you don't have a pride parade ... be grateful you don't need one!,0
1784,3658,"Go kill yourself you giving a bad rep for all minorities you fucking cum licker , dick chomper , big red",1
1786,18129,So fucking annoying. Fuck this shitty faggot.,1
1787,39510,wow what a retardedly retarded retard,1
1789,10860,There's a strong correlation between sexual/violent assault and homosexuality. An overwhelming percentage of serial killers were gay/bi.,0
1791,4917,lmao get a load of this faggot,1
1803,4909,Eveyone who I've dated so far has been bisexual. So far 2/3 have been cool as shit,0
1804,35597,fr diva gays are the worst types of faggots. take some phenobarbital and chill b4 i come for your whole life,1
1805,22599,I bet you kiss girls faggot shit fit,1
1806,8594,You fookin homophobic piece of shit.,0
1809,3612,"I know that feeling. I may not be LGBT myself, but I have loads of LGBT friends",0
1811,46517,FU Trevor Dumb Noah you little fag.,1
1812,10535,"You can tell Gay Activists to ""get behind me, Satan.""",0
1814,48259,"Wow, conservatives are really angry and bitter over these super strong women. Their whining and pain is immense and I love it.",0
1816,11372,"Fuck gays and lesbians fuck them, they poison the word!!! Shitty libtards disliking",1
1818,8568,Fucking thin-skinned pansy cunts,1
1823,44391,Another disgusting pervert homosexual,1
1824,42172,Homosexual acts are a sin.,1
1825,20857,nina dancing with her mascot is what the gays deserve,0
1826,49192,My dog has a higher IQ than you're transgender Daddy's sperm baby,1
1830,26064,This stupid ass tranny teacher should be thrown in prison for brainwashing children about a lifestyle that too often tragically ends in suicide. #LGBT ,1
1831,48762,Fags all of you,1
1833,15102,I'm fucking those big sweet tits 🤤,0
1835,21334,"popsirens, popcrave, popalarms holy shit the faggots cant come up with something else",1
1836,20609,invest your time wisely such as calling people faggots online,0
1837,30398,Imagine one parent being so excited to have a baby regardless and the other isn't because of the gender.,0
1838,45037,How much money does female football make compared to male football??? There is a reason for the pay difference and it has nothing to do with gender!!!!!!,0
1839,26510,filthy gay fucks ,1
1842,47517,5 kids with 3 wives makes you a patriot now? And you all say gays have ruined the sanctity of marriage.,0
1844,45410,He looks kinda gay because he wears earrings,0
1846,11922,"I was lucky enough to find a therapist that is trans himself, so I've been doing great. Unfortunately it's not that easy for everyone else",0
1847,5592,The only thing r/trashy here is your homophobia OP,0
1851,22554,#PrideMonth  #PrideMonth  #PrideMonth  #PrideMonth. Because there is not enough LGBTQ+ representation.,0
1852,2369,"Haha amiright, fuck that fag",1
1853,46346,He is gay,0
1855,27413,I think this is the time of year companies use PRIDE aesthetics to appear inclusive but don't hire LGBTQ+ identifies persons. Fascinating!!,0
1857,15932,it actually would suck having a cock that big...couldnt even bottom out in 99% of girls,0
1861,32532,gays are really something else...,0
1862,4068,"<3 I am also a bit bi, I never wanted straight sex, I always wanted to plessure someone.",0
1864,32619,Go fuck yourself dumb bitch,1
1867,8370,Well they are also the closet homosexuals. The rest are all open about it now. No one cares but the most evil folks.,0
1868,244,What's misspelled Faggot?,1
1870,2854,Faggot meltdown apocalypse,1
1871,37235,i eat child specifically gay child because i hate gay people,1
1872,38642,We can't stop thinking about this amazing LGBTQ+ representation in #DnD!  ,0
1874,49071,fucking shit talentless gay agenda pushing slut,1
1876,4975,"10/10 bro as a bi dude I can say your look perfect and I'm not saying this as a pickup line, you genuinely look good",0
1877,10630,Yeah that trans fag should just kill himself already.,1
1878,11164,Further proof that reddit is filled with mentally ill trannies.,1
1880,48105,Clever cold asf you just a simple minded fag,1
1881,19642,I wish I had the courage to come out as trans I'm so jealous but my family doesn't exactly like the lgbt community,0
1882,15411,"You're a fag and a retard, and not even the good kind like us.",1
1883,2691,"Faget from the point where he goes ""I'm just a pretty boy whatever you call it""",1
1885,17736,I liked that one special where he flailed his arms around and shouted like a faggot.,1
1886,10202,"Ah yes, that's it. The gays are just so violent.",0
1890,50070,Fuck you go die you fucking bitch ugly ass bitch,1
1893,46326,Yes your homosexual family is an international embarrassment I suggest you all kill yourselves today as soon as possible,1
1895,14985,They are quite similar but ours is openly homophobic. So I guess I win? :(,0
1896,13225,sending messages of infinite support and validity as an amab trans person who feels similarly!,0
1897,19522,Go choke on a bag of flaming dicks you little bitch.,1
1899,12138,"Trans people exist. They are our friends, they are our allies, they are our family. They deserve to be recognised.",0
1902,8564,eat my asshole faggot,1
1903,11823,Full of neon haired lefty sodomites. These faggots would gobble Little Potato Justin every chance they'd get.,1
1905,9551,"Grow a spine, come fuck me yourself faggot.",1
1908,10832,Don't project your grandpas faggotry on mine,1
1912,26532,I can tell when a bitch is fake gay and it's so annoying,0
1913,23406,Stupid ass Bitch,1
1916,41571,333 999 You are an educated emotional fag,1
1918,26122,straight pride looks wild,0
1919,15898,Omg shut up you dick riding faggot,1
1920,44297,Fuck u burn and fuck u in the ass fuck you just die bichy,1
1921,12056,I know they're genderswapped but I didn't expect fem squadra to be cute,0
1923,14571,"Lol, if straight folks could fuck as easily and quickly as gay men they would be fucking in the streets.",0
1924,24734,"In honor of #PrideMonth, read @adamlambert's love letter to the LGBTQ community  ",0
1925,19497,you're a faggot. suck on my nuts,1
1926,8438,don't underestimate the powers of bi men,0
1927,44933,"Why do we need this, both genders are already equal and so are all races and sexual orientation",0
1928,48288,these freaks need to be dropped off on devils island near south america and left to rot. penises cut off too,1
1932,44551,California is gonna disappear because it has gay people in it,1
1936,12108,Communist faggot dick sucker. Go put your mask back on you pussy ass bitch.,1
1937,16145,you're a faggot too,1
1938,46598,"I bet he bows to satan, another sodomised gentile.",1
