id,text,anti_lgbt
0,39773,The trans women reading this tweet right now is beautiful,0
1,11001,Sounds like the kinda wholsesome life I'd die for ❤️ never met any black Lesbians before so i guess you're my first ever.,0
2,17034,Fuck off you insufferable retarded faggot.,1
3,23643,9) uhhhh i like being lgbt a lot. i feel proud of what i have done to help others in my community,0
4,7287,This sub is full of grade A faggots  Comedy fucking Ebola,1
6,11121,"They wanna fuck so bad, just do it already, nobody cares if you're gay.",0
7,19352,As a slightly feminine top I appreciate all masc bottoms that enjoy a dude like me,0
9,16311,Disregard all the science that says there are only two genders; looks like you're just fucked in the head.,1
10,16019,"Nice! As a bi couple, we thoroughly enjoy bi dad friends =)",0
11,47899,i almost puke seeing this transvestite,1
12,16356,Dark skinned men wearing pink shirts always make me swoon a little bit.,0
17,13193,nope. my happily married lesbian buddy/supervisor/boss is super cute.,0
18,23629,it's pride month give ur money to black trans women,0
19,10501,If you respect trans rights you are good enough <3,0
20,6770,Well faggots can have they're gay little parades why can't straights?,1
22,12046,"No not again, fuck off fag",1
23,19244,Huzzah! Am Bisexual. Currently crushing on Megan Rapinoe.,0
26,17156,Shut the fuck up faggot.,1
28,18677,my boyfriend and i are both bi! makes the relationship stronger imo,0
29,315,Go suk his tranny dick don't get in my grill,1
31,4574,"I'm not gay, so there is no point in trying to sweet talk me, faggot.",1
32,42739,And rot in hell you little boy peepee touching faggot Michael jackson,1
33,10369,The problem here is that no women want to be with disgusting bigots like you all.,0
34,9810,I'm Bi and I am proud of what I made. This is a very welcoming sub so I wanted to share,0
35,8498,Trans people are people. They expect the same variety of things from their partners as everyone else.,0
37,13573,i'm half pinoy and half filipino but i take pride in being both 100%.,0
39,40501,no one fucking cares fag,1
43,22048,"With pride arriving in just a couple days here, let this be your reminder. ACE PEOPLE ARE PART OF THE LGBTQ+ COMMUNITY. ",0
45,9382,Faggots that need to be re educated,1
55,20163,You sound like cold a faggot literally a bitch,1
56,45446,only 2 genders . these people are morons .,1
58,6126,hahaha funnyy repost haha fuck you faggot fuck fuck you are so fucking like you dumb bitsch,1
59,3670,I hope you die you fucking bitch,1
61,42020,shut your mouth tranny,1
63,12931,"As a transwoman myself, this makes me so happy and horny to know I might have a place in this sub more than just lurking! :)",0
64,47424,"On behalf of the lesbians, we love your raspy lesbian voice! Haha!",0
66,49775,YES! THE GAY GODDESS IS BACK!!,0
70,12944,"As a Black and a gay and also a cowgirl I couldn't have asked for more legendary representation, BGCs we own billboard now!!",0
73,42804,Fuckin loser fag,1
77,19310,"You should hang yourself, faggot",1
78,48708,Philbert and Tommy are now LGBT+ icons.,0
80,42125,"Nice try at Bating, fucking faggot.",1
81,38053,Girls with big tongues who don't eat pussy is worthless to humanity,0
84,23684,@TheStrawberry_P I'll fucjing kill him fucjing faggot,1
85,16224,Apparently bi men can't either,0
87,10720,"Not weird at all. Happens to me, too, as a trans guy.",0
89,10144,Cry more fag,1
91,8537,We should rather see what the LGBTQ+ community did in India. They were an organic movement. They were also successfull.,0
96,35392,That is a homophobic slur!,0
99,6851,".... Which means they're closeted and forced to abide by heterosexual norms to escape violence, not that they're not gay.",0
100,10784,"You gotta hit her with ""did you just assume my gender"" ***modern problems require modern solutions",0
101,41718,I'm proud of this! Nothing more than a little gay boy wanting attention anyway he could get it!,1
102,33515,@Defaulting12 @JuicetopherWrld @FortniteGame shut up faggot,1
105,23173,lgbt stands for the members of the dragon knights! Lancelot Gay vane Bercival The legendary siegfried,0
108,5924,"thank you and i hope your rights and recognition continue to improve.just not like this, competing against non-trans females.",0
109,5460,Fuck you smurf ass faggot. Go drink bleach.,1
112,2343,and fuck gay people,1
114,11659,I hope your canaries get sodomized by this fat Greek faggot,1
115,31473,Gender is such a silly reason to oppress half the population for most of history.,0
116,27403,"#Feminist #spirituality aims to revitalize relational, cosmologically grounded spiritual possibilities for women & all others~C. Spretnak",0
120,38855,also compart bisexuals to pedophiles again and i will literally come to your house and cut off your ears,0
122,604,"Fuck off yourself, fag.",1
125,15580,I'd liked to fuck the gay out of her.,1
128,16593,"Bi actually, will you shut the fuck up and play player match if I eat your ass?",0
129,44750,"Hi, I just wanted to say that the relationship between a dyke and a gay is no right, but I love the fic.",0
132,5109,eat a dick faggot,1
133,9039,"On behalf of all gay people, fuck off.",0
134,6291,"See faggots, this is why we call you faggots. Not the normal gay persons, but the faggots.",1
137,14616,Bisexual is actually straight with extra step,0
138,4256,"As a fellow bi person, I actually agree. But I hardly think - as you say - having a problem with pride is the way to go.",0
140,719,One's gay the other's autistic. ​ It's what fags learn to do vs autists,1
142,42440,Lesbian Christian... must not read the Bible at their church lol,0
144,43171,That the only kid that ant balck ass fuck plus I bet his older son don't support all the gay shit smh,1
145,40190,"Next do: ""Do all gay men think the same"" I wonder how they react to the differences",0
146,3663,don't tell me what to do you fucking faggot. you fucking hentai-deprived overhydrated bastard faggot.,1
147,28970,i hate gays so much,1
148,41572,treytown530 nigga u gay shut your cocksucking mouth,1
149,18789,Lol what a faggot,1
151,9639,You're fucking crazy. Crazy people like you need to be sterilized.,1
152,12463,But it's ok when physicians use it against trans patient?,0
153,47156,And a faggoty flamer,1
155,44700,What they both failed to mention is Monica Beverly Hillz was the first openly trans contestant on the show,0
156,30526,trans* women please apply,0
157,6652,I didnt even register this was a gay wedding hahah i guess thats a good sign though.,0
161,21396,"and to the transphobic gays... we're just fine without y'all too. back to the sewer, musties!",0
164,3512,"You know a lot of gays also resent it too, right? Go buy another shit product with an American flag on it, lol.",0
165,16780,That's good. I support the LGBT community,0
167,34320,Nothing makes me happier than knowing that in mythology Orpheus is canonically one of the first bisexuals,0
169,47592,Fuck off faggot why u need subs ass sucker,1
170,46867,"Nuclear fire to all you faggots, whores, lesbians, adulterers",1
175,31807,@ABNINEFIVE @ImBackMaybe Faggots,1
176,3202,You look like a ficking pedophile you ugly fat faggot. Die,1
179,48375,Libtards: sensitive politically correct FAGGOTS,1
183,11263,I'm sorry that your dad treats you like that but Good luck to you and hope for the best (I'm a Trans Female btw),0
185,19055,go to hell so you can go fuck lucifer some more you fucking tranny bitch,1
187,11615,Straight girls compliment each other. Gay/bi girls complement each other.,0
188,11523,"sorry, your inverted dick looks like a split ball sack.  There's nothing female about it, just male mental illness.",1
190,36059,Brain dead retard!,1
191,22617,Colorado's first gay governor signs his first round of pro-LGBT legislation.  #copolitics #coleg,0
192,10817,How about you lie down so I can tbag you you little fag?,1
193,41986,Mulan is the original 90's trans hero. She stands as a symbol for a movement that is big and relevant right now.,0
197,49880,Biracial lesbian yea that's shouldn't ve a pastor and we have a different definition of Christian,0
202,8065,youre a fat faggot lol you got banned from the madlib board bitch nigger,1
203,18968,"This mod is a fucking phaggot, ban me you fucking coward",1
204,44166,Asshole lezzy rapcunt carpet muncher anti American. Needs to meet her maker.,1
206,17099,Suck my short dixk faggot,1
208,46100,"HAPPY BIRTHDAY jaden,enjoy life being gay and I wish I make more friends who are gay",0
211,17119,"Oh yeah, and mabye you'll realise that gender is tied to sex and that your just a copeing faggot in denial",1
214,38248,Lesbian & bisexual women with cancer face greater aftercare hurdles ,0
215,3019,I live in boystown in Chicago so everyday is pride day for me lol. (and I don't mean that in a bad way),0
216,16148,You're still a fucking loser faggot,1
220,15685,The fact that your money is going to oppress gay people and oppose access to birth control,0
225,10734,Couldn't make it past those faggots in the first 5 seconds. I could smell the BO and unwashed assholes through my phone.,1
227,16544,two trans people happy together.  Sweet,0
229,47598,Bunch of faggots. Stop mentioning Queen. Freddy Mercury was an actual faggot but you two are bigger faggots than him.,1
231,17499,"You seem like an absolute faggot, maybe get back off reddit",1
233,9853,I'll follow your faggot ass into that store.,1
238,12692,You people are such faggots.,1
239,21862,I hate the smell of fags they fucking make me sick 🤢🤢🤢,1
241,46340,"I can easily tell by this video that you are a man with fragile masculinity and irrealistic standards, and, truly, i feel bad for you",0
242,7529,This is me but opposite. I'm telling myself I'm gay but had sex with women and most likely will again.,0
246,7956,We don't like Redditor or faggots around here. We certainly don't like autistic faggots such as yourself,1
248,26070,"In the US, Pastors and Priests cannot control the one-eyed snakes in their pants that's why they sexually abuse children and vulnerable adults. ",0
249,36254,Trans women have the best taste. ,0
251,12701,"My ex girlfriend was trans, so it's really nice to see other trans girls being represented. Thanks 😘",0
254,7834,Eat a dick and die faggot,1
257,14695,with your mom's pussy you faggot,1
264,4642,Aither deserves to be recognized for the LGBT woman she is.,0
265,9444,I hope your parents fucking drown in my shit you absolute gay faggot,1
269,11180,"What is gender, separate from stereotypes?",0
270,7512,shut up gay prick,1
272,15606,"""I have a gay friend"" And they're a dipshit for being friends with a homophobe like you lmao",0
278,49674,They're all a bunch of faggot ass munchers at morehouse anyway,1
282,1740,Sounds like a great way to get murdered by some self loathing homophobes.,0
283,34814,I don't even want a boyfriend but like a gay best friend would be nice,0
285,7290,youre a fag,1
288,19090,I'm sure you like to delegitimise issues the trans community faces... You clearly want to throw one group under a bus :P haha,0
290,45061,LESBIAN DEMOCRAT UGLY WHORE,1
291,14562,"They'd only be fucking retards if somehow a Dutch dick ended up in your ass, you fag.",1
292,42883,Lol because must of em are lgbt States u homosexuals getting your wake up call by god,1
293,25622,@ChrisEvans We must kill every trash gay and lesbian in this world or it will end .,1
295,24722,I use both bisexual and pansexual to describe myself.,0
297,3947,My heart breaks for your brother and every other LGBTQ raised in this cult. Love is love ✊🏳️‍🌈,0
298,1027,go suck a dick u shit stain,1
303,41512,Keep your mouth shut fag ass bitch. White boy down,1
304,41372,Straight up faggot,1
305,4955,Mary Brasch has a lot of experience with lgbt people and i think she's very easy to talk to,0
307,11387,Be extravagantly gay.,0
308,33477,Being gay is the best thing I have lived for,0
309,46597,Cute boi with the trans flag uvu,0
313,49736,A perfect example of why I'm bi is this video,0
316,43297,What a gay boy. He needs to be stoned for his sins. Which is being gay.,1
319,42019,Yuck bitch look a faggot shemale looking bitch,1
320,4352,I suck a cock once a year just to make sure I don't like it and I'm not gay.,0
321,15154,"This one time, at the Apple store, I updated a guys status so everyone thought he was gay.",0
322,5189,"I believe I speak for most here when I say shut the fuckin up, faggot.",1
323,33498,Gay dudes be gettin absolutely zero pussy,0
324,12432,"Dude, mostly by men like lesbian porn is like the #1 searched porn term, if I remember correctly. Especially by men.",0
329,8757,"I hope you go to area 51, because they shoot on sight. Sooo in short, DIE YOU GAY BITCH",1
336,39561,Bitch FUCK YOU!!! Fucking dumb ass bitch I hope someone fucks you up for this,1
338,2934,We love trans inclusion,0
342,43419,I've never been more bi and straight simultaneously than during this video,0
343,21330,fucking CUNT dumb WHORE stupid IDIOT,1
344,15390,Fucking trans piece of shit mongrels,1
345,4785,Ah the response of a low iq faggot hope you didn't hurt yourself thinking up that one,1
347,4914,"Yeah, I appreciate that. Tbh, I feel like in the lgbt community trans people get the most shit.",0
352,23976,Little comic about trans miyuki because it's pride month  Part 1/5 ,0
355,33078,Can't stand gay people ,1
359,17205,Fake: anon made friends with a girl.  Gay: anon doesnt want to have sex with girl.,0
361,11806,At least I'm not stupid enough to mutilate my dick,1
362,13702,I'm a trans girl and I love this place!!!,0
363,3191,Karma whore gay cunt eat shit,1
364,40374,GAY people are scientifically Mentally disturbed people...THE gay men act like women and the Lesbians act and dress like men..WTF,1
366,7118,Hey faggots fuck you LULW,1
367,47742,A class act and a miserable dyke talking to a liberal puss,1
372,9340,Kill yourself instead,1
373,16163,Pot is so powerful I became a gay years before I even shot it up 😞😩,0
374,17097,You're asexual because no woman would drop her standards so low. Fuck off you loser.,1
376,3336,what a fag,1
377,4085,People who like traps are gay.,0
378,3390,"Isn't he a pedophile? If he hates imperialism, why'd that fag accept knighthood!",1
380,10612,Ruling party is using the dehumanisation of LGBT people as a rallying thing before the elections this fall. Basically NSDAP tactics.,0
381,19949,wish i was there to shoot all the fags down,1
382,7963,"Alright, gay fag",1
383,12155,What is this faggot shit,1
385,26899,"Team Hick stands tall for all, especially this nation's powerful, loving, unstoppable LGBTQ community. Happy #pride month. ",0
387,13293,It's Almost as if most people are heterosexual.,0
392,9336,NTA Her insecurity issues are her problem.  It's healthy for people to have platonic relationships with people of all and any gender.,0
394,17756,Yeah I feel that. My little sister came out as pan right around the time I figured out that I'm trans. It was a little awkward,0
398,6195,Ever chop off your dick cuz your mentally inSAne,1
400,18559,My fiancé is bisexual so I've learned it all from her. And you're welcome my friend,0
401,13967,Suck my balls you illiterate fuck.,1
403,24650,*and on June 1st all the planets aligned and lit up in pink blue and white in solidarity with trans persons everywhere*,0
404,35571,Lover lesbian. now !,0
407,1431,The dumbasses born in the 90s are the ones doing the gender shit,1
408,19750,Fucking homos. Go to hell,1
412,39675,do *****fags think were retarded?? lmao we got somethin planned dont worry #commiesrevenge,1
413,41728,look at this fucking Fagget,1
415,17089,"Jesus Christ. These people are fucking faggots, where's the autist shooters when you need one",1
417,34051,if you hate jules you're transphobic that's it it's just the facts,0
419,8720,33 people are fucking dead and this socialist piece of shit is celebrating... There are no words throw this faggot out of a helicopter.,1
420,17501,Too right. Scotland had demonstrated that it is a firmly pro-EU country and is in the transition to becoming a full member.,0
421,37230,jojo's bizarre adventure isn't boring ur just homophobic,0
422,14679,"I hate that us gays let annoying straight girls take over, like, GTFO BETHANY!! We don't want u here!",0
423,9493,Kill all trans people,1
427,17804,Why are you so retarted?,1
428,32764,@30SecFight faggots jumping them deserves cancer,1
429,3575,In your mouth fag,1
430,1477,What you deserve when you make faggy suicide jokes,1
432,13778,I hate you cause u ugly and gay,1
433,21502,Serious question for trans people.  Does anyone know any international trans rights organisations who hold the position that trans women are not women?,0
435,14172,"Back then it was still known as ""gay cancer"" or GRID (gay-related immuno deficiency) so those bastards just didn't care.",0
436,27547,happy frickin pride to all the ladies & gays #pride #gay ,0
437,14511,I don't mind any orientation as long as it you.,0
439,42289,Shut up homo,1
443,13479,"Fellow Bi woman here, you are stunning! 😍",0
445,47923,Lesbian love story,0
447,22789,Happy Pride Month To All Friends And Followers I Have. Anyone Bothered By My Support For The LGBTQ Community Hit That Unfollow Button G.,0
448,10190,Thank you for this. Very important to me and my trans brothers.,0
449,6650,You want to lip ass? Clearly you're the faggot here.,1
450,49274,Gays don't go to heaven,1
452,106,How about Trans Uneducated Reactionary Dipshit,1
454,5334,Furry trash go fuck a dog,1
455,255,So basically you want someone to come to you and let you best them. You are a Faggot AND a pussy,1
456,1040,Get the fuck out of here you pussy ass bitch go suck your moms dick you faggot,1
457,30950,I've been living my true queer self. Being out and proud is lit as fuck.,0
461,3516,They're gay for banning Pete,0
462,21760,"see this is why straights view us as overly-sexual people, yall dumb as f*ck",0
465,3082,"This is fucking doooooope Rock on, my LGBT+ peeps. <3",0
467,17970,Fucking gay faggot go suck a rick,1
468,14737,yeah go hang yourself you kick spamming fag nobody likes fighting nobushi,1
469,7112,Shut the FUCK up fucking faggot,1
471,32353,"Finally, a baseball team that represents my gay experience. Visibility matters y'all #cubs #sportyspice @ Wrigley Field ",0
475,12037,"16, transgender, and getting top surgery in two days :D",0
476,19785,Your mom is homosexual,0
477,12208,Me and my sister came out bi when we were 14,0
479,6642,"Come on and get ya some, you pussy faggots. We're ready with open arms.",1
480,17674,"Fuck you, youre doing the same thing you disgusting fag.",1
481,31006,@marclousery Dumb fag.,1
482,23123,Follow this fella. He's coming to the heterosexual parade in July.,0
486,947,Do you know for sure hes gay?,0
487,8982,Go suck that inbred white cock ya fucking faggot,1
488,7880,Fuck yourself in the dick pussy bitch,1
489,47051,No shade but I just assumed she was a lesbian 🤷‍♂️,0
492,364,"Who CARES you fucking faggot. Oh no, faggot is a slerr",1
496,10069,Kill yourself cunt,1
497,27615,"Wow. Thank you, @ArianaGrande for not being afraid to shut down this sexism and homophobia. ",0
498,8544,what? neeko isn't gay she is an orthodox christian pastor and believes in the traditional family unit i play on league of legends russia btw,0
499,15521,Your IQ is somewhere in the low 20s if you think this LGBT garbage is JUST about homosexuality.,1
501,16322,I'm Bi too and I live in a very accepting household and even I am scared of coming out. Good job for doing it and good luck!,0
503,15584,it's only gay if you're a gril,0
504,6485,"I bet she has sucked dick, those lips touched his. Anon has now had dick on his mouth. Anon is a faggot.",1
505,31931,"Honestly given how many people have buried their gays, y'all better watch out when the zombie apocalypse comes",0
506,47166,+Make Racists Afraid Again you're nothing but a fucking skinny little tweaker faggot cocksucker,1
507,10551,My Lesbian Soul <3,0
508,46220,EVS why do you think Wolverine is gay??? Hough Jackman is gay. But why the Wolverine hate?,0
509,11724,United States of Muslim America ​ It's good to know faggots will still be shot,1
510,16559,"Block as ya want, shits gay",0
512,1878,TRANS GAY LESBIAN AND BISEXUAL/PANSEXUAL UNITE! HELP SUPPORT THIS PERSON,0
513,14490,Both drag culture and trans women would be far better off if we'd shot RuPaul into the sun 20 years ago.,0
515,48470,Tranny queers homosexual propaganda how about the real issue stop geoengineering stop the chemtrails or just whack me off,1
516,14636,"Well, still pretty gay act though",0
518,22471,stupid BITCH,1
519,6390,You VAPE.  God hates you more then gays.,0
521,14261,Only way Mayor Pete is a radical to Shapiro is because Shapiro very much hates the gays.,0
523,48176,I am having a gay crush on the germany girl lol,0
524,14760,What if a tranny attacks me with a aids laced meth needle? I'd actually be terrified,1
528,7817,Well technically discrimination IS illegal. It's racism and sexism that's the problem. But discrimination still occurs like that gay wedding cake thing,0
530,17868,stop posting faggot,1
534,13539,Suck a duck faggot!,1
537,46965,Fuck those lesbians.they hate the u.s.a.. Equal pay? They don't make the money like the men.,1
539,42580,"I cant tell if this is for furries or gays, but it's sure not for me.",0
540,12206,High-five bi brother. Indeed it does rule,0
542,22781,"Happy pride month, remember that trans women of color were at the forefront of the struggle and they still are",0
544,48593,This is so cute! I so proud! even thought I'm not apart of the LGBTQ community I still want to support everyone being them self!!!!,0
547,45730,@Paul polo Faggots are the destruction of everything. Every rotten inner city is made by them.,1
548,1119,What do you expect from tranny extremists?  There double crazy.,1
549,11437,"Who will defend us from communistic agendas there's too many transgenders, we straight white males, they will end us :(",0
550,15476,when you're befriending a white dude and he feels comfortable enough to tell you his many thoughts on black trans women,0
551,12745,Well in English it means means a bunch of degenrate men or women fucking their own gender.You are very stupid normie.,1
553,13789,"i have nothing against homosexuality in the slightest, i'm bi myself, but can someone explain to me how it's a ""blessing""?",0
554,19239,Fellas is it gay to recycle? You're literally just giving your junk to another man to mess with idk,0
557,43015,Ping looks a lot like a girl in this video. I think I might be gay for him.,0
559,43137,Fuck t series i hope suck your own dick pewdiepie is better then you . You mom is gay too,0
563,11583,Fight me faggot,1
564,45111,A transgender and a homosexual promoting their LBGT religion. Mmm. Your star player is a transgender man! How is that fair to women?,1
570,2794,Omg I'm a gay woman too and I can't stop playing!!! Something about pretty anime boys is just nice,0
572,10299,"fags are kiddie fuckers thats why, I used to support them, no more",1
573,40654,Tattle Boad Ur Gay and you gave me Ebola,0
580,10157,Wow what a giant faggot,1
584,13141,Come smoke my pole you flaming faggot,1
585,6719,But would they be smashing LGBTQ skulls?,0
589,40083,Gay faggots there a hate comment track me now bitch,1
592,30347,i'm gay as fuck bring it to the dm's s'il vous plait,0
593,21361,dumb fucking bitch,1
595,35197,Where the single friendly lesbians at ? Not the ones wit gfs in whole relationships an pregnant tf,0
596,14107,first presidential nominee to support gay marriage,0
604,13566,2 people that I know of transitioned after hs and a ton of us turned out lgb- so a little education wouldnt hurt.,0
605,5521,Fuck this faggot,1
609,4200,I don't want to make everything lgbt. Nearly all of my favorite ships are straight. I just wanted to make something for pride month.,0
610,14478,Burn in Hell you psycho bitch,1
612,37206,SHUT THE FUCK UP YOU DUMB BITCH,1
613,23759,if ur a he him lesbian ur fucking stupid,0
618,18726,"For sure. It doesn't bother me what her sexual orientation is, as long as we like each other that is all the matters.",0
619,23220,Gays and Bi are the worst type of people and pride month is the worst month! #PrideMonth #PrideMonth2019,1
621,13626,You're fucking gay and no one cares about little gay faggots like you.,1
622,6599,Im gay and I approve this message,0
624,17168,Beigefrequency ran off to cumtown like a retarded faggot,1
625,12607,Don't let Adam's homosexuality distract you from the fact that Ian admitted to eating out a fleshlight in order to get hard,0
630,3109,Happy pride month!! If only my parents weren't homophobic and there was a pride parade near me;(,0
631,9362,homosexual acts are a sin,1
632,19399,I think yer a faggot,1
633,40624,Fuckin fagit.,1
640,8983,"doesnt that sub have rules for civility? if thats so making shitty jokes falls under that, stop being triggered over nothing faggot loser",1
641,40766,Jesse Mathis gay people aren't hurting anyone. Those are.,0
643,18807,she has transitioned and her wife is fully supportive,0
644,17427,I'm just gonna mention that trans women exists and this seems tangently related. Trans girls are valid and you're valid ❤️,0
645,22784,JUST IN: Gillibrand celebrates Pride Month by unveiling LGBT rights agenda  ,0
649,10595,I told him it was gay. He said im gay too  It tastes so fucking good.,0
655,44669,I swear u was a girl in the thumbnail but ur a gay dude broo,0
658,15215,What a fucking dipshit faggot.,1
659,26090,Fuck them fags,1
662,7262,please go back into hiding your month is over now it's not okay to be gay,0
663,3682,That would be game over for the human race unless the gay men still reproduced,0
